Text,Date,search_term
"USA ain't drankin da MAGAritas! MAGArita-1part Lysol,1part purell, splash of bleach &amp; hydroxychlorquine to taste. Leave in sun to soak up rays for 1hour. Drink &amp; head to rally! Causes blatant lying, low IQ, lack of empathy &amp; poor judgement. Nov. Make Happy Hr gr8 again! ",06/21/2020,lysol
"USA ain't drankin da MAGAritas! MAGArita-1part Lysol,1part purell, splash of bleach &amp; hydroxychlorquine to taste. Leave in sun to soak up rays for 1hour. Drink &amp; head to rally! Causes blatant lying, low IQ, lack of empathy &amp; poor judgement. Nov. Make Happy Hr gr8 again! ",06/21/2020,lysol
"USA ain't drankin da MAGAritas! MAGArita-1part Lysol,1part purell, splash of bleach &amp; hydroxychlorquine to taste. Leave in sun to soak up rays for 1hour. Drink &amp; head to rally! Causes blatant lying, low IQ, lack of empathy &amp; poor judgement. Nov. Make Happy Hr gr8 again! ",06/21/2020,lysol
"USA ain't drankin da MAGAritas! MAGArita-1part Lysol,1part purell, splash of bleach &amp; hydroxychlorquine to taste. Leave in sun to soak up rays for 1hour. Drink &amp; head to rally! Causes blatant lying, low IQ, lack of empathy &amp; poor judgement. Nov. Make Happy Hr gr8 again! ",06/21/2020,lysol
"USA ain't drankin da MAGAritas! MAGArita-1part Lysol,1part purell, splash of bleach &amp; hydroxychlorquine to taste. Leave in sun to soak up rays for 1hour. Drink &amp; head to rally! Causes blatant lying, low IQ, lack of empathy &amp; poor judgement. Nov. Make Happy Hr gr8 again! ",06/21/2020,lysol
"USA ain't drankin da MAGAritas! MAGArita-1part Lysol,1part purell, splash of bleach &amp; hydroxychlorquine to taste. Leave in sun to soak up rays for 1hour. Drink &amp; head to rally! Causes blatant lying, low IQ, lack of empathy &amp; poor judgement. Nov. Make Happy Hr gr8 again! ",06/21/2020,lysol
"USA ain't drankin da MAGAritas! MAGArita-1part Lysol,1part purell, splash of bleach &amp; hydroxychlorquine to taste. Leave in sun to soak up rays for 1hour. Drink &amp; head to rally! Causes blatant lying, low IQ, lack of empathy &amp; poor judgement. Nov. Make Happy Hr gr8 again! ",06/21/2020,lysol
sho did and she gone talk about just spray it with lysol and i was like what if it come flyin to me and she said “well just keep sprayin it...” aint no type of encouragement. i’m over here contemplating life while remy tryin to steal the cook book,06/21/2020,lysol
i blame @juliersndz bc this bitch decided to talk about flying roaches (idek if the one that came back to life was a roach bc at first i thought it was a hornet or some shit) but next you know i’m fightin these things with lysol bc grandma aint had no bug spray,06/21/2020,lysol
"Is AMC staff disinfecting the seats, arm rests with cupholders, & spraying with lysol-like disinfectant in the air of the theater between each show? Otherwise, I'll pass. ",06/21/2020,lysol
BRUH THE BIG ASS FLYING ROACH I KILLED LAST NIGHT WITH LYSOL CAME BACK TO LIFE...LIKE HOW...I DROWNED THAT BITCH-...you know what granny this the last time i’m comin to your house...sis you had remy scurryin around and the whole bugs life cast out here. i aint bout it,06/21/2020,lysol
It's the Lysol.,06/21/2020,lysol
For along time I thought I wasn't a millenial because I'm at that in between age but I looked it up and I'm a millenial i have all the traits my little brother is not,06/21/2020,lysol
OMG...U r so lame. The Dems impeached Lysol Trump &amp; the Senate refused to remove him from office. Only to find out that he not only asked Ukraine but China as well. Wake up little man !!!!!! – at Family Dollar,06/21/2020,lysol
So why is it that we still cant buy lysol wipes in grocery stores ? Ppl are back to work every one can see that trucks are running stores are open why is every one still hording ? @KerryandTrigger,06/21/2020,lysol
"Biggest “conspiracy” of #COVID19 - the disappearance of @Lysol aerosol spray. They said back in April they were working “round the to make Lysol for consumers” - over 2 months later, what happened?? #lysol ",06/21/2020,lysol
"Rump drankin to many MAGAritas! MAGArita-1part Lysol,1part purell, splash of bleach &amp; hydroxychlorquine to taste. Leave in sun to soak up rays for 1hour. Drink &amp; head to rally! Causes blatant lying, low IQ, lack of empathy &amp; poor judgement. Nov. Make Happy Hr gr8 again! ",06/21/2020,lysol
"QUarens be drankin da MAGAritas! MAGArita-1part Lysol,1part purell, splash of bleach &amp; hydroxychlorquine to taste. Leave in sun to soak up rays for 1hour. Drink &amp; head to rally! Causes blatant lying, low IQ, lack of empathy &amp; poor judgement. Nov. Make Happy Hr gr8 again! ",06/21/2020,lysol
"QAren be drankin da MAGAritas! MAGArita-1part Lysol,1part purell, splash of bleach &amp; hydroxychlorquine to taste. Leave in sun to soak up rays for 1hour. Drink &amp; head to rally! Causes blatant lying, low IQ, lack of empathy &amp; poor judgement. Nov. Make Happy Hr gr8 again! ",06/21/2020,lysol
"QAren be drankin da MAGAritas! MAGArita-1part Lysol,1part purell, splash of bleach &amp; hydroxychlorquine to taste. Leave in sun to soak up rays for 1hour. Drink &amp; head to rally! Causes blatant lying, low IQ, lack of empathy &amp; poor judgement. Nov. Make Happy Hr gr8 again! ",06/21/2020,lysol
"USA ain't drankin da MAGAritas! MAGArita-1part Lysol,1part purell, splash of bleach &amp; hydroxychlorquine to taste. Leave in sun to soak up rays for 1hour. Drink &amp; head to rally! Causes blatant lying, low IQ, lack of empathy &amp; poor judgement. Nov. Make Happy Hr gr8 again! ",06/21/2020,lysol
Oh that's not good. Pardon me while I go smother myself in hand sanitizer and Lysol. Thank you! ,06/21/2020,lysol
"USA ain't drankin da MAGAritas! MAGArita-1part Lysol,1part purell, splash of bleach &amp; hydroxychlorquine to taste. Leave in sun to soak up rays for 1hour. Drink &amp; head to rally! Causes blatant lying, low IQ, lack of empathy &amp; poor judgement. Nov. Make Happy Hr gr8 again! ",06/21/2020,lysol
"QArens be drankin da MAGAritas! MAGArita-1part Lysol,1part purell, splash of bleach &amp; hydroxychlorquine to taste. Leave in sun to soak up rays for 1hour. Drink &amp; head to rally! Causes blatant lying, low IQ, lack of empathy &amp; poor judgement. Nov. Make Happy Hr gr8 again! ",06/21/2020,lysol
"USA ain't drankin da MAGAritas! MAGArita-1part Lysol,1part purell, splash of bleach &amp; hydroxychlorquine to taste. Leave in sun to soak up rays for 1hour. Drink &amp; head to rally! Causes blatant lying, low IQ, lack of empathy &amp; poor judgement. Nov. Make Happy Hr gr8 again! ",06/21/2020,lysol
Keep watching. They are handing out Clorox Lysol shooters any minute. What a laughing stock. It’s over they are all leaving. Sarah cooper has lots of new material. ,06/21/2020,lysol
He’s getting dipped in Lysol after! With an enema chaser!,06/21/2020,lysol
"USA ain't drankin da MAGAritas! MAGArita-1part Lysol,1part purell, splash of bleach &amp; hydroxychlorquine to taste. Leave in sun to soak up rays for 1hour. Drink &amp; head to rally! Causes blatant lying, low IQ, lack of empathy &amp; poor judgement. Nov. Make Happy Hr gr8 again! ",06/21/2020,lysol
"USA ain't drankin da MAGAritas! MAGArita-1part Lysol,1part purell, splash of bleach &amp; hydroxychlorquine to taste. Leave in sun to soak up rays for 1hour. Drink &amp; head to rally! Causes blatant lying, low IQ, lack of empathy &amp; poor judgement. Nov. Make Happy Hr gr8 again! ",06/21/2020,lysol
I tried to make wild yeast from limes and I think I made Lysol instead? #help,06/22/2020,lysol
What they gonna do spray @Lysol in the air?,06/22/2020,lysol
El aerosol Lysol,06/22/2020,lysol
Have some cloraquine and Lysol and get back to us in the morning. Mr. Grumpy needs a nap.,06/22/2020,lysol
Comment below to inquire about what Lysol products are available or text (337) 428-4749. I’ll be posting pictures and prices soon!,06/22/2020,lysol
Covid-19 or coronavirus is not over Don’t let y’all guards down because you will risk your health and everyone’s around you. I found some Lysol products but yall gone have to pay of course if you are seriously interested! ,06/22/2020,lysol
I was able to get 2 Lysol Spray for $6.99 each.,06/22/2020,lysol
"USA ain't drankin da MAGAritas! MAGArita-1part Lysol,1part purell, splash of bleach &amp; hydroxychlorquine to taste. Leave in sun to soak up rays for 1hour. Drink &amp; head to rally! Causes blatant lying, low IQ, lack of empathy &amp; poor judgement. Nov. Make Happy Hr gr8 again! ",06/22/2020,lysol
"USA ain't drankin da MAGAritas! MAGArita-1part Lysol,1part purell, splash of bleach &amp; hydroxychlorquine to taste. Leave in sun to soak up rays for 1hour. Drink &amp; head to rally! Causes blatant lying, low IQ, lack of empathy &amp; poor judgement. Nov. Make Happy Hr gr8 again! ",06/22/2020,lysol
@WKBWedreilly saw your story about the woman who needs Lysol. I have an almost full can I’ll give her if you can contact her or provide her contact details. ,06/22/2020,lysol
"QAren be drankin da MAGAritas! MAGArita-1part Lysol,1part purell, splash of bleach &amp; hydroxychlorquine to taste. Leave in sun to soak up rays for 1hour. Drink &amp; head to rally! Causes blatant lying, low IQ, lack of empathy &amp; poor judgement. Nov. Make Happy Hr gr8 again! ",06/22/2020,lysol
"Next up; Pres. #Trump's new #Covid19 treatment! Simply face the 'son' to catch HIS rays, then take Dr.Trump's magical #Covid_19 elxir™ w/ Hy...hy..dro..droxy..so...quine™ It's his pat. pend. formula of LYSOL, Hy...hy..dro..droxy..so...quine™, herbs 'n spices. @dreamcitychurch https://twitter.com/hwinkler4real/status/1275136370860670976",06/22/2020,lysol
"Omg finally Costco finally stocked up on scrubbing bubbles that just made my day now I just need Clorox wipes, Lysol, &amp; gloves ",06/22/2020,lysol
Who is this “we” he speaks of? YOU DID NOTHING YOU PIECE OF SHIT! Telling people to take an untested drug and/or drink bleach/inject Lysol into their veins WAS NOT HELPFUL! ,06/22/2020,lysol
"$11 for ONE bottle of Lysol wipes at Quiang Wang Trading Inc in Sunset Park, BK- 5614 56th Street. Price gouging to the nth degree. 917- 969- 6098. @TishJames can this be checked out?",06/22/2020,lysol
"So, they’re gonna spray a can of Lysol?",06/22/2020,lysol
"QUaren be drankin da MAGAritas! MAGArita-1part Lysol,1part purell, splash of bleach &amp; hydroxychlorquine to taste. Leave in sun to soak up rays for 1hour. Drink &amp; head to rally! Causes blatant lying, low IQ, lack of empathy &amp; poor judgement. Nov. Make Happy Hr gr8 again! ",06/22/2020,lysol
"this? USA ain't drankin da MAGAritas! MAGArita-1part Lysol,1part purell, splash of bleach &amp; hydroxychlorquine to taste. Leave in sun to soak up rays for 1hour. Drink &amp; head to rally! Causes blatant lying, low IQ, lack of empathy &amp; poor judgement. Nov. Make Happy Hr gr8 again! ",06/22/2020,lysol
"A spritz of Lysol on the pews would do the same thing. It’s the infected people coming into the church that is the danger. These guys are not geniuses, stay home.",06/22/2020,lysol
Happy Father’s Day. #artmarissas #coronavirus #buttercreamcake #papertoilet #lysol #sanitizer #mask #cake en Marissa's Cake https://www.instagram.com/p/CBwBRvFgmZb/?igshid=12dacuhbqhaof,06/22/2020,lysol
#lysol #clorox I inhaled 500cc mixture of both and like magic goes away #BunkerBoy,06/22/2020,lysol
"USA ain't drankin da MAGAritas! MAGArita-1part Lysol,1part purell, splash of bleach &amp; hydroxychlorquine to taste. Leave in sun to soak up rays for 1hour. Drink &amp; head to rally! Causes blatant lying, low IQ, lack of empathy &amp; poor judgement. Nov. Make Happy Hr gr8 again! ",06/22/2020,lysol
@Lysol Thanks for making #homefeellikehomeagain #Lysol #Tennessee #stayhome #staysafe,06/22/2020,lysol
"Fiesta en mi kaza, traigan su lysol y cubrebocas ",06/22/2020,lysol
I encourage all #Chicago residents to fully stock your fridges and pantries. Stock up on lysol and cleaning products because in Sept I believe will be in a worse spot then we were in March of 2020. #COVID19 #COVIDIOTS #Phase4,06/22/2020,lysol
"Mask, Sanitizer in the car and you gotta know I carry Lysol EVERYWHERE. My parents/Immediate family are Older and I can’t afford to get them or myself sick. It’s up there until folks realize this shiit not over and it’s going to get worse if they don’t still use common sense. ",06/22/2020,lysol
"USA ain't drankin da MAGAritas! MAGArita-1part Lysol,1part purell, splash of bleach &amp; hydroxychlorquine to taste. Leave in sun to soak up rays for 1hour. Drink &amp; head to rally! Causes blatant lying, low IQ, lack of empathy &amp; poor judgement. Nov. Make Happy Hr gr8 again! ",06/22/2020,lysol
"USA ain't drankin da MAGAritas! MAGArita-1part Lysol,1part purell, splash of bleach &amp; hydroxychlorquine to taste. Leave in sun to soak up rays for 1hour. Drink &amp; head to rally! Causes blatant lying, low IQ, lack of empathy &amp; poor judgement. Nov. Make Happy Hr gr8 again! ",06/22/2020,lysol
"USA ain't drankin da MAGAritas! MAGArita-1part Lysol,1part purell, splash of bleach &amp; hydroxychlorquine to taste. Leave in sun to soak up rays for 1hour. Drink &amp; head to rally! Causes blatant lying, low IQ, lack of empathy &amp; poor judgement. Nov. Make Happy Hr gr8 again! ",06/22/2020,lysol
"Amazon Fresh has Lysol in the South LA area if y’all need it, max is 3 cans",06/22/2020,lysol
Party bus this weekend to Winstar told my nigga Marty he can’t hop on the bus till we check his temperature &amp; spray em down w/ Lysol ,06/22/2020,lysol
"Logic and the Republicans are oil and water. Who is the idiot who thinks the Republicans are logical.Using Lysol for coronavirus is logical? How about making up facts day after day is that logical? Tax breaks for billionaires, is that logical? et Cetera et Cetera et cetera",06/22/2020,lysol
"Vendo Lysol... ¡Carísimo! Ora, si no quieren pagarlo carísimo, lo pueden comprar en @TiendaSoriana. Servidos... de nada.",06/22/2020,lysol
"@AICM_mx @DeniseMaerker en Aeroméxico no nos permiten transportar un aerosol Lysol en maleta documentada, por instrucciones del Aeropuerto o Aeronáutica. Pueden confirmar por favor que ya no podemos transportarlo? Es una época difícil para hacer esta restricción.",06/22/2020,lysol
"USA ain't drankin da MAGAritas! MAGArita-1part Lysol,1part purell, splash of bleach &amp; hydroxychlorquine to taste. Leave in sun to soak up rays for 1hour. Drink &amp; head to rally! Causes blatant lying, low IQ, lack of empathy &amp; poor judgement. Nov. Make Happy Hr gr8 again! ",06/22/2020,lysol
"USA ain't drankin da MAGAritas! MAGArita-1part Lysol,1part purell, splash of bleach &amp; hydroxychlorquine to taste. Leave in sun to soak up rays for 1hour. Drink &amp; head to rally! Causes blatant lying, low IQ, lack of empathy &amp; poor judgement. Nov. Make Happy Hr gr8 again! ",06/22/2020,lysol
"USA ain't drankin da MAGAritas! MAGArita-1part Lysol,1part purell, splash of bleach &amp; hydroxychlorquine to taste. Leave in sun to soak up rays for 1hour. Drink &amp; head to rally! Causes blatant lying, low IQ, lack of empathy &amp; poor judgement. Nov. Make Happy Hr gr8 again! ",06/22/2020,lysol
I just wanna find some Lysol ,06/22/2020,lysol
"USA ain't drankin da MAGAritas! MAGArita-1part Lysol,1part purell, splash of bleach &amp; hydroxychlorquine to taste. Leave in sun to soak up rays for 1hour. Drink &amp; head to rally! Causes blatant lying, low IQ, lack of empathy &amp; poor judgement. Nov. Make Happy Hr gr8 again! ",06/22/2020,lysol
"Anytime I’m at the store, if I see hand sanitizer, I buy that shit, Lysol spray, I buy that shit, I jus found some sanitizer wipes and they let me buy 3 of them THANGSSSS ",06/22/2020,lysol
Remember the bitch that put lysol on her pussy on boosie live ?,06/22/2020,lysol
"Proper towels, tissue, plug ins, bleach, Lysol, laundry detergent, body wash, case of water...today was a success in my parents garage ",06/22/2020,lysol
"What the heck is wrong with people. This lady cleaned out all the hand sanitizer, spray Lysol, and Colorox Wipes, plus soft soap from @Walmart. .. Set limits to stop stupid people",06/22/2020,lysol
I’d spray Lysol on their face para que se les quite lo pendejo,06/22/2020,lysol
"USA ain't drankin da MAGAritas! MAGArita-1part Lysol,1part purell, splash of bleach &amp; hydroxychlorquine to taste. Leave in sun to soak up rays for 1hour. Drink &amp; head to rally! Causes blatant lying, low IQ, lack of empathy &amp; poor judgement. Nov. Make Happy Hr gr8 again! ",06/22/2020,lysol
"Something wrong in the left frontal lobes, become senile and lots of neuron die and synapses don't happen anymore, probably excessive use of the hydroxychloroquine, and Clorox and Lysol, combine with Heavy UV shot...",06/23/2020,lysol
"In 20 years, we will see lawsuit commercials for Lysol just like with asbestos &amp; mesothelioma.",06/23/2020,lysol
Anyone want to bet on how many lawsuits @Lysol &amp; @Clorox will get to overexposure to their disinfectants?,06/23/2020,lysol
The Corona virus is on the back of a Lysol can. It's been there for years. It's the flu. #MAGA,06/23/2020,lysol
They better come correct when I’m there. I will spray a bitch with Lysol LOL.,06/23/2020,lysol
There's 2 pallets of Lysol wipes at the Walmart on 87th and 12 ave in Doral,06/23/2020,lysol
Amazon is charging $27 for Lysol wipes. ,06/23/2020,lysol
"Amigos de CDMX me urge un lysol o alcohol, ¿alguien tiene certeza de un supermercado que sí tenga?",06/23/2020,lysol
"USA ain't drankin da MAGAritas! MAGArita-1part Lysol,1part purell, splash of bleach &amp; hydroxychlorquine to taste. Leave in sun to soak up rays for 1hour. Drink &amp; head to rally! Causes blatant lying, low IQ, lack of empathy &amp; poor judgement. Nov. Make Happy Hr gr8 again! ",06/23/2020,lysol
"Nikki be drankin da MAGAritas! MAGArita-1part Lysol,1part purell, splash of bleach &amp; hydroxychlorquine to taste. Leave in sun to soak up rays for 1hour. Drink &amp; head to rally! Causes blatant lying, low IQ, lack of empathy &amp; poor judgement. Nov. Make Happy Hr gr8 again! ",06/23/2020,lysol
"USA ain't drankin da MAGAritas! MAGArita-1part Lysol,1part purell, splash of bleach &amp; hydroxychlorquine to taste. Leave in sun to soak up rays for 1hour. Drink &amp; head to rally! Causes blatant lying, low IQ, lack of empathy &amp; poor judgement. Nov. Make Happy Hr gr8 again! ",06/23/2020,lysol
I found lysol in the grocery store for the first time in months,06/23/2020,lysol
So he WAS serious about injecting Lysol in to the body,06/23/2020,lysol
But I thought we were supposed to inject Lysol in our veins?? I’m so confused.. ,06/23/2020,lysol
i still never went get my Lysol ,06/23/2020,lysol
"Get a room, and be prepared to eat all of your meals in said room. A lot of sleeper guests brought Lysol but my room wasn’t really problematic. Also, my viewliner was almost full- I think that’ll be the trend moving forward.",06/23/2020,lysol
...also spray disenfecent (ie: Lysol),06/23/2020,lysol
@OutnumberedFNC How is it Dr fiasco has Lysol wipes an I haven’t been able to find any in the past 4 months nor Clorox wipes nor cans of Lysol spray or they reserving them for Congress an Hospitals??,06/23/2020,lysol
"Wh*te people looove buying organic, almost as much as they love forgetting organic means no preservatives and your produce will rot faster. Like bro, grab the Lysol and clean the slime out of the crisper drawers. ",06/23/2020,lysol
This just in! Lysol sanitizer $23.99 a gallon limit 1 per customer. @TrueValue @HolyCitySinner @Charlestonion,06/23/2020,lysol
"En papelerema vi que vendían un spray tipo lysol, pero no sé que ingredientes tenga la vd",06/23/2020,lysol
@BreauxMart any updates on Lysol spray? ,06/23/2020,lysol
Non-revving for the first time in months and i forgot the to bring Lysol wipes for the seat/tray table/seat belt/headrest/window shade/arm rests And yes i did this way before COVID. These planes are nasty,06/23/2020,lysol
"No, no it’s a hoax. Virgin Lysol on the rocks for Trump supporters",06/23/2020,lysol
Just don’t spray the Lysol during a movie. I nearly murdered the person sitting front of me who kept spraying an air freshener during a screening of Eternal Sunshine of the Spotless Mind.,06/23/2020,lysol
Got my cans of Lysol! Now I’m set for the year on cleaning supplies,06/23/2020,lysol
"USA ain't drankin da MAGAritas! MAGArita-1part Lysol,1part purell, splash of bleach &amp; hydroxychlorquine to taste. Leave in sun to soak up rays for 1hour. Drink &amp; head to rally! Causes blatant lying, low IQ, lack of empathy &amp; poor judgement. Nov. Make Happy Hr gr8 again! ",06/23/2020,lysol
"QAren be drankin da MAGAritas! MAGArita-1part Lysol,1part purell, splash of bleach &amp; hydroxychlorquine to taste. Leave in sun to soak up rays for 1hour. Drink &amp; head to rally! Causes blatant lying, low IQ, lack of empathy &amp; poor judgement. Nov. Make Happy Hr gr8 again! ",06/23/2020,lysol
"QAren be drankin da MAGAritas! MAGArita-1part Lysol,1part purell, splash of bleach &amp; hydroxychlorquine to taste. Leave in sun to soak up rays for 1hour. Drink &amp; head to rally! Causes blatant lying, low IQ, lack of empathy &amp; poor judgement. Nov. Make Happy Hr gr8 again! ",06/23/2020,lysol
"NYC ain't drankin da MAGAritas! MAGArita-1part Lysol,1part purell, splash of bleach &amp; hydroxychlorquine to taste. Leave in sun to soak up rays for 1hour. Drink &amp; head to rally! Causes blatant lying, low IQ, lack of empathy &amp; poor judgement. Nov. Make Happy Hr gr8 again! ",06/24/2020,lysol
"NYC ain't drankin da MAGAritas! MAGArita-1part Lysol,1part purell, splash of bleach &amp; hydroxychlorquine to taste. Leave in sun to soak up rays for 1hour. Drink &amp; head to rally! Causes blatant lying, low IQ, lack of empathy &amp; poor judgement. Nov. Make Happy Hr gr8 again! ",06/24/2020,lysol
"USA ain't drankin da MAGAritas! MAGArita-1part Lysol,1part purell, splash of bleach &amp; hydroxychlorquine to taste. Leave in sun to soak up rays for 1hour. Drink &amp; head to rally! Causes blatant lying, low IQ, lack of empathy &amp; poor judgement. Nov. Make Happy Hr gr8 again! ",06/24/2020,lysol
"Evil Pelosi Spreads Dangerous Misinformation, Claims President Trump Urging People to “Inject Lysol and Drink Bleach” https://www.thegatewaypundit.com/2020/06/evil-pelosi-spreads-dangerous-misinformation-claims-president-trump-urging-people-inject-lysol-drink-bleach/",06/24/2020,lysol
"This is my magic potion....one third of each ingredient, and put in a spray mist bottle , mostly peroxide and alcohol , I also have added diluted Comet , we have had no Lysol since Feb., limited bleach #nyc )",06/24/2020,lysol
I am putting them...we need to know WHY #nyc is not getting #Lysol. ( there must be a reason right ? ),06/24/2020,lysol
"I am nicely asking why are you not sending Lysol to #nyc, please don't give me a stock answer, as a #nycnurse I need it. Where are you shipping in #NYC ? and if you aren't shipping here , can you tell us WHY ? Thank you for your help with this critical Pandemic Health issue.",06/24/2020,lysol
"People really by buying all the Lysol &amp; Clorox wipes at the store, but don’t wear their masks properly in public w/ their nose sticking out. ",06/24/2020,lysol
Exactly....not ok...,06/24/2020,lysol
"Pelosi Spreads Dangerous Misinformation, Claims President Trump Urging People to ""Inject Lysol and Drink Bleach"" https://www.thegatewaypundit.com/2020/06/pelosi-spreads-dangerous-misinformation-claims-president-trump-urging-people-inject-lysol-drink-bleach/?utm_source=Twitter&amp;utm_campaign=websitesharingbuttons via @gatewaypundit",06/24/2020,lysol
"We had the gloves, the mask, hand sanitizer and Lysol but still got pregnant #QuarantineBaby #Dec2020",06/24/2020,lysol
"Hi @Lysol so is there a reason why people in other states can get Lysol, but here in #NYC we can't get any, and have not been able to get any since the end of February, it is now June 23, 2020 almost July. ( And yes I can give you a list of other states ). #nycnurse #PPE",06/24/2020,lysol
People really making a profit with these Lysol sprays still I’m not about to pay $20 for one can,06/24/2020,lysol
You know what 's weird ...I talk to other people in other states and they can get @Lysol....so why can't we in #NYC ?? It makes no sense.....6/23/20,06/24/2020,lysol
Right now I am running really low on Lysol wipes and I need them for work. I have not seen any for sale since like February or March.,06/24/2020,lysol
"A estas alturas, si nuestro presidente es un pendejo que normaliza todo para que salgas y sales a mamarte o a comer a algún lugar, eres aún más pendejo que el, trabajo y actividades esenciales son suficientes, lugar donde voy parezco el 33:12 con cubrebocas, lysol y van a chapu?",06/24/2020,lysol
Let me answer that question. NO! Anytime a grown ass 74 year old man. Believes General Washington defended the airfields during Revolutionary War! Drinking bleach & Lysol disinfection will cure COVID-19! Can't possibly understand something so simple! His IQ won't allow it! ,06/24/2020,lysol
" Just a spoonful of Lysol helps the hydroxychloroquine go down, the hydroxychloroquine go down the hydroxychloroquine go down! Just a spoonful of Lysol helps the hydroxychloroquine go down In the most delightful way !",06/24/2020,lysol
Be bout to die in here spraying bleach and Lysol and faboloso ,06/24/2020,lysol
You are now at “@Hero Status”!,06/24/2020,lysol
@LAFitness please address this issue immediately. 3 strikes and ur out rule needs to go into effect ASAP. Taking temp at the door &amp; not being able to use lockers just isn’t enough. I bring my own Lysol wipes and hand sani. ADD MORE DISINFECTANT STATIONS.,06/24/2020,lysol
¿No quieres venir a hacer aseo a la mía?,06/24/2020,lysol
