Text,Date,search_term
"If you told me in Jan that by May, I’d see robot spy gorillas recording farts while we’re in quarantine a week after the crazy Blink-182 guy was vindicated by the Pentagon confirming UFO videos & POTUS tried to get us to inject Lysol, I’d have punched you ",05/07/2020,lysol
"Yeah it did go up in by 25,000 and it jumped up a month as well so it jumped in two ways to be honest we need a leader who will take charge and not tell people to protest or tell people to drink bleach or Lysol like what wrong with trump y wasn’t he given a psychological exam ",05/07/2020,lysol
Lysol lover,05/07/2020,lysol
And I tell you what.. if this pandemic is still going on in November I am going to vote even if I have to dress in a bunny suit and take a bath in Lysol afterwards. ,05/07/2020,lysol
I've given up on seeing Lysol being sold in stores til late next year,05/07/2020,lysol
Glad I don’t have to worry about my bf while he’s at work during this pandemic. He will literally Lysol you in the face if niggas get too close ,05/07/2020,lysol
@ReporterBlayne Awesome story Clorox Please do a story on LYSOL I hope they let you buy a box lol Awesome work!!,05/07/2020,lysol
We Americans want Dr Fauci Dr Brix NOT you or Pence but will keep pence if we have to. But not you. Lysol bleach windmills... What else are you going to tell Americans? ,05/07/2020,lysol
"This dude’s filmography reads like the TP, PT and Lysol; that crap is NON EXISTENT.",05/07/2020,lysol
Crackpot...you libs and your conspiracy theories...dont you have some lysol or chlorox?,05/07/2020,lysol
Lysol spray Lysol wipes clorex wipes.Maybe the fastest thing people is buying.The shelves stay empty were they are located.,05/07/2020,lysol
Plot twist... What if they put covid in your lysol and TP!? ,05/07/2020,lysol
Cleaning the house? Looking for #Lysol ? Keep this WoolClean Kit on hand for the next carpet emergency. Works on nylon carpet too. http://hemphillsrugs.com/products/woolc… - Use CODE: WOOL2020 for 20% off a checkout,05/07/2020,lysol
@every lockdown protester voting for a man who suggested injecting Lysol for coronavirus ,05/07/2020,lysol
"To be clear.. by gringos I meant the Government. As canadian/latina person we do have our share of fuckery on all levels, but the Trump administration is a fuckin circus. Inject them with Lysol.. they should test that and “protect” their rapey students. See how that goes ",05/07/2020,lysol
Trueques del 2020: lysol por mascarillas ,05/07/2020,lysol
"Even with a funeral done via Zoom, attended by a handful of people in person with masks on who could not embrace each other, and who had to Lysol the shovel before each scoop of dirt, I gotta say...the Jewish rituals… https://www.instagram.com/p/B_3ukoBDxON/?igshid=nz12lddz8wa2",05/07/2020,lysol
Lysol,05/07/2020,lysol
"just tried to use LYSOL as a fucking substitute for febreeze, guess how that went",05/07/2020,lysol
Hey y’all if u run outa Lysol wipes just pour some of ur Lysol cleanser in a container of wipes and voila!! U got Lysol wipes! Make it work!,05/07/2020,lysol
Your guy advised you to inject some Lysol. Have you tried it yet? ,05/07/2020,lysol
2 months later and Lysol still sold out - I’m convinced y’all drinking that stuff ,05/07/2020,lysol
"Yeah, all the experts recommended to drink bleach and inject Lysol",05/07/2020,lysol
I still have yet to see Clorox Wipes or Lysol. Today was the first time I have seen toilet paper.,05/07/2020,lysol
I’ve been trying to find Lysol at stores to disinfect my insides. No luck. Please help this supply chain issue Donald!,05/07/2020,lysol
I’m gonna need y’all to chill with the excessive lysol use. Next person to blast carcinogens in my face is getting a knuckle sandwich ,05/08/2020,lysol
"Lt. Lysol, I can help you comment on Kayleigh's, soon to be, untimely exit. First you tell her ""Ya Fired"". Very generic. Next, the follow up, ""I'm sure she's a really great gal"" ""Although, I didn't know her "" Huh, huh, pretty good you slime sucking bottom feeder #VoteJoe #Resist",05/08/2020,lysol
"If you’re selling Lysol for $100 on EBay, let me be the first to remind you we’ll never be friends. ",05/08/2020,lysol
"Lysol Donnie, I think you hired all the swamp creatures. How many of your cronies ended up in jail or charged? So do you really think the American public believe what comes out of your pie hole anymore? Smfh",05/08/2020,lysol
No! Inject them with Lysol!,05/08/2020,lysol
Lysol seems to work @realDonaldTrump,05/08/2020,lysol
President Lysol,05/08/2020,lysol
We can’t test because results change over time? Did someone put Lysol in his Diet Coke?,05/08/2020,lysol
"MAKE A CORONA PALLET Shade names: Lysol, hand sanitizer, &amp; Charmin",05/08/2020,lysol
Now if only there were @Lysol wipes...,05/08/2020,lysol
Provide all of them with Lysol drips or Clorox rinses.,05/08/2020,lysol
I'll be using cans of Lysol ,05/08/2020,lysol
Trying to purify himself with 'powerful light'. I guess chugging the Lysol didn't work.,05/08/2020,lysol
Look at empeach lying moron draft daugher trumputin LoL lol have a Lysol cocktail LoL lol ,05/08/2020,lysol
18 cash for Lysol ,05/08/2020,lysol
I’m so sad I cannot find any Lysol-specially the Spring Waterfall! I usually always have some but since this pandemic I can’t find any! @Lysol I miss you,05/08/2020,lysol
3 pack yo.. one for studio two for home,05/08/2020,lysol
Good glad you hear you doing good. But I cant wait till shit get back right. I’m over this bs. Y’all got Lysol &amp; cleaning products down there ,05/08/2020,lysol
someone tell my why the gas station is tryna charge me 16.99 for ONE container of lysol wipes...,05/08/2020,lysol
"I can't believe she didn't have access to injectable Clorox and Lysol. And UV light up her ass, too. It's all HER fault for not listening to Dr Trump.",05/08/2020,lysol
I’m not worried about Trump catching the #coronavirus. All they need to do is dose him with hydroxychloroquine and inject him with Lysol and he will be fine.,05/08/2020,lysol
Have a Lysol cocktail LoL lol ,05/08/2020,lysol
Have a Lysol cocktail LoL lol ,05/08/2020,lysol
Have a Lysol cocktail LoL lol ,05/08/2020,lysol
Have a Lysol cocktail LoL lol ,05/08/2020,lysol
Have a Lysol cocktail idiot ,05/08/2020,lysol
Have a Lysol cocktail idiot ,05/08/2020,lysol
So all he has to do is drink some Lysol and he’ll be fine.,05/08/2020,lysol
It was like walking into a time capsule . The only shocking thing was my can of Lysol and hand sanitizer wasn’t stolen and I was totally shocked!!!!! . #wearewoodlawn… https://www.instagram.com/p/B_78rzoHHJx4t-ld-GqomeaYTVoC8KOKVqO9lQ0/?igshid=1bagilz825161,05/08/2020,lysol
All we want for Mothers Day is Lysol Spray and toilet paper,05/08/2020,lysol
"I’m writing 2 songs inspired by the #Coronavirus. I’ve noticed that I need to write down all ideas, to get bad ones out of the way. So here are some lyrics I’m NOT using: Together again The curve will fall We can be friends No more Lysol",05/08/2020,lysol
"China, the Dems? The possibilities are endless. Let's not forget, Lt. Lysol, has an elixir. Raise a glass. Through the teeth, past the gums, lookout stomach, here it comes Drink up, limp dick ",05/08/2020,lysol
Have a Lysol cocktail LoL lol ,05/08/2020,lysol
Have a Lysol cocktail LoL lol ,05/08/2020,lysol
Have a Lysol cocktail LoL lol to celebrate lol ,05/08/2020,lysol
Have a Lysol cocktail LoL lol idiot ,05/08/2020,lysol
They had to wait for extra Lysol injections.,05/08/2020,lysol
I feel like I just won the lottery @Lysol ,05/08/2020,lysol
I saw this video and 100% changed my mindset! I started quarantine 3/10 nobody telling me to Lysol my groceries. 3 weeks later now we have to Lysol groceries I NEVER HAVE! Now we don’t have to! It’s to much wishy washy info being given! I’ve been out and I haven’t gotten sick!,05/08/2020,lysol
"Smh I keep having dreams about Lysol , ready for this corona to clear up ",05/08/2020,lysol
YES - You and all your pundits must be flushed into the historical political sewer for all time with the seal of WARNING —-CONTAMINATED SLIME CONTAINER —- NEVER AGAIN - ALL BLEACHED WITH XTRA STRENGHT LYSOL - DO NOT OPEN UNDER ANY CIRCUMSTANCES - THE DESTROYERS OF AMERICA!!!,05/08/2020,lysol
But did he drink Lysol?,05/08/2020,lysol
"Post COVID-19 intimacy; C-19 found in sperm? Reach for the Lysol ladies. *DISCLAIMER: Under no circumstances should you ever consider douching with Lysol!!! (Unless, you’ve been intimate with @realDonaldTrump *",05/08/2020,lysol
"Still drinking the Trump Kool-Aid, Jonathan? Does it have a Lysol chaser? ",05/08/2020,lysol
"25 cases of malignant cooties if you ask me. They don’t make enough Lysol to douche @realDonaldTrump away. Ewww, right?",05/08/2020,lysol
Why my momma came in my house invading my privacy to spray lysol and wipe down door knobs and light fixtures lady go home please my daughter face timed me like look at Grandma it’s a gift and a curse for yo mom to stay downstairs lol,05/08/2020,lysol
bro I bought a Puff Bar to see what the hype was about and it really feels like I just inhaled Lysol WHAT,05/08/2020,lysol
Muy Buendía actualmente vamos viviendo tiempos diferentes y no se diga en el actuar médico quien iba a pensar que todos los productos de sanitizacion desde los básicos #lysol #clorox… https://www.instagram.com/p/B_7u6ViDARe6Ku2LWV4Kt2oLIfrG6Tpt2ehMLo0/?igshid=1y0svvuvwq07t,05/08/2020,lysol
@AskTSA Are alcohol wipes allowed for carry-on/personal bag? Like a tub of them? I know Lysol wipes are allowed. The plan is to bring a tub of each + some hand sanitizer. Hope that’s ok? Is there a limit on how much there can be?,05/08/2020,lysol
How about a shot of Lysol! ,05/08/2020,lysol
So did the Lysol and purell companies go out of business??? I Haven’t seen any in two months in metro Detroit! ,05/08/2020,lysol
@Andy Thought you’d like this... Fresca is harder to find than Lysol!! ,05/08/2020,lysol
If you have Lysol spray I’m willing to buy that shit off u,05/08/2020,lysol
any one know when @Lysol spray and wipe going to be available again... It's been a few months and I'm running real low.,05/08/2020,lysol
Have a Lysol cocktail first lol ,05/08/2020,lysol
Have a Lysol cocktail Jr. Lol lol ,05/08/2020,lysol
"These #darkmoney 1_%ers have billions of dollars to fund this divisive hatred. Yesterday Trump learned NO ONE is immune from this pandemic; CORVID-19 in the White House! Now he is all in favor of testing, for Himself! If he is positive, he can try injecting Lysol! Crazy times! ",05/08/2020,lysol
"es viernes, y el cuerpo lo sabe! make sure you get your wrist band for the open bar at the next @realDonaldTrump rally... bleach body shots, mistolin mojitos and fabuloso flaming homers #trumpmemes #lysol #clorox #covid19 #coronavirus #maga #comepingainchief #potus",05/08/2020,lysol
So you donated some of your hard earned (??) Benjamins to Slow Joe? Makes sense I guess when u take into consideration that CNN is an appendage of the DNC.....And once again u spread falsities about ingesting LYSOL....Nobody would ever recommend that not even the DUMBASSES @CNN,05/08/2020,lysol
I want to see the families of anyone who injested bleach or Lysol sue your Dad personally. ,05/08/2020,lysol
"I’m trying to make my mother a #MotherDaybasket with #cleaning supplies in it so if anybody know where I can get some #Lysol from let me know because she is gone berserk for some #lysolspray @Newark, New Jersey https://www.instagram.com/p/B_7XzI0lFQM/?igshid=1tbvmrlul2fux",05/08/2020,lysol
"Nothing has brought me more joy this morning than seeing my husband text me “I found pancake mix”. They’ve been out for weeks! Now if he finds Lysol, he’s made my Mother’s Day! Little joys in times of Quarantine. #Covid_19 #StayHome #mothersday2020 #mothersdaygiftideas",05/08/2020,lysol
It would probably help if he took the hydroxychloroquine with a cup of Clorox. And maybe a Lysol chaser. ,05/08/2020,lysol
"Paper towels, daily Lysol cleaner, and masks, “oh my!” @TrueValue @HolyCitySinner @Charlestonion",05/08/2020,lysol
"Social Distancing up in here! My Suites smell like a Clorox Bleach Factory! I’m old school.... It ain’t clean unless it smells like: Clorox Bleach, Pine Sol, Lysol or Ammonia! I may need a respirator AFTER I… https://www.instagram.com/p/B_7QpYEA155/?igshid=bj40m4aztktx",05/08/2020,lysol
Lysol spray and a towel twice a day and soap and water after the last round like they normally do... average cart price $20 per golfer for 18 holes and since gas is so cheap it offsets the cost of the Lysol... golf courses should be given the choice... freedom to do it their way,05/08/2020,lysol
Chill fam! I got you with the Lysol spray and hand sanitizer lmfao,05/08/2020,lysol
"That’s why you take your shoes off at the door and wear house shoes/chanclas in the house only. No bare feet touch the ground. Since COVID, I spray my outside shoes with Lysol.",05/08/2020,lysol
If they add LYSOL I'll be your slave lmao,05/08/2020,lysol
Been doing this for months now. WAY cheaper than sanitizers & cleans beautifully. Out of Clorox or Lysol? These 7 Hydrogen Peroxide Uses Might Save the Day #Topbuzz,05/08/2020,lysol
How could his valet catch a hoax? Didnt he use enough lysol and bleach?,05/08/2020,lysol
 SCORE!!!! What a great deal I found on eBay! - #coronavirus #covid2020 #covid19 #covıd19 #coronaviruspandemicrealness #coronavíruspandemia #covıd19pandemic #cornoaviruspandemic #panicbuying #lysol… https://www.instagram.com/p/B_6qIjFnxXF/?igshid=wd8eas6484ei,05/08/2020,lysol
They are injecting bleach and Lysol into every part of him.,05/08/2020,lysol
I’m not takin not one more sip of nothing til i find my fkn Lysol,05/08/2020,lysol
where the fuck is my Lysol...,05/08/2020,lysol
WAS IT THIS ADVISOR WHO GETS LYSOL INJECTIONS ???!!!! ,05/08/2020,lysol
Great Night to see the #Moon! I heard staring at it for 30 sec is even effective than drinking Lysol! #robtherealtor peanutsmartypants #dachshund #minidoxie #bestdogever #superpup #eclipse #star… https://www.instagram.com/p/B_6fBfqlGy6/?igshid=1fvxht7qst3ig,05/08/2020,lysol
"Si, los que se inyectaron Lysol.",05/08/2020,lysol
Lysol.,05/08/2020,lysol
When are we going to be hearing from the head of the CDC. Now the CDC issued a plan for opening up America. Now we have it being EDITED by the White House. This is being done by Dr Trump. ... Mr inject Lysol. Scary thought,05/08/2020,lysol
The jerk 4 becoming prez is behind his own reality demise. Dont put that on the CDC or the NIH u sound dummer than he is. I guess the CDC told DT to wait 70 days b4 u do anything. I guess the CDC told DT tell Americans 2 inject theirselves with Lysol. U r pathetic u clown ,05/08/2020,lysol
Hey guys I’ll have a couple tubs available if anyone I know IRL needs it. I wasn’t gonna order this cuz I got lucky w/ the Clorox wipes but now I can use those for work. Gonna keep one Lysol tub for myself. Gonna drop off one to a friend tomorrow. HMU if you need one ,05/08/2020,lysol
Go to hell asswiper with yo Lysol bottle and uv lights dummy,05/08/2020,lysol
"Yikes, I am peeps as it relates to my frozen foods. Thank you for sharing",05/08/2020,lysol
No-one with a brain should even think about re-electing this goon..What a useless human being. Then tells americans to inject themselves with Lysol and UV lights. How Pathetic can you be? #NOTREELECTABLE #PATHETIC,05/08/2020,lysol
Maybe he had Lysol Facial just like his Daddy.,05/08/2020,lysol
The Lysol Liver Killer. #TrumpDisinfectant,05/08/2020,lysol
Maybe if trump try’s out his Lysol theory he can prove everyone wrong. Just to be safe though he should stick a UV light up his butt too. Just to be safe.,05/08/2020,lysol
S/O to @_kcauley for letting me know Bristol had Lysol &amp; S/O to the employee that took me &amp; a man from LCI to the back to get 1 of the 3 bottles they had left #COVID19,05/08/2020,lysol
"when was the last (or first) time a trump admin person gave you a succinct answer to your questions? This dr. Burx is doing nothing more than pontificating and blah blah blah ing instead of answering. Whe trump suggested injecting Lysol, she should have stopped him cold. Covfefe",05/08/2020,lysol
Or just inject him with lysol and shove a tanning bulb up his ass,05/08/2020,lysol
"I brought everybody a can of Lysol for Mother’s Day, they better not complain",05/09/2020,lysol
Is he home drinking bleach and huffing lysol yet? In the sunshine??? ,05/09/2020,lysol
"His gut feelings on this are SO on target, like will go away, “in days, magically, when it get warm, we ich 4HQ, with an injection of Lysol”. If you believe his gut, maybe you and he should take an anti diarrheal med NOW!",05/09/2020,lysol
Should be easy to social distance from trumpy ewww.. after I have my drink of lysol with my morning omelet,05/09/2020,lysol
"Lo bueno es que lunes regreso a mi oficina y pues ya tengo listo mi lysol y no planeo salir de ahí solo para irme a mi casa... a ver como nos va! Mientras tanto pues espero solo estar ""overreacting"" y ya volveremos a la rutina...",05/09/2020,lysol
Bet you don’t even see the irony in your analogy.,05/09/2020,lysol
About ME....About Me... About Me!! That’s what the hell you are talking about at a time like this. Get a life and leave the management of the country to the professionals... oh yeah... you think your a pro..Dr Trump. Take another shot of Lysol will you!,05/09/2020,lysol
Yes I do...EVERYTHING gets wiped down n Lysol,05/09/2020,lysol
"The first person to injest bleach, Lysol, and UV light to fight covid. ",05/09/2020,lysol
"Well Oranolinie did say it would be gone by Apr. Oh, and it would go from 15 cases to 0. Oh, and the drinking of bleach and mainlining Lysol were classics. tRump supporters no doubt. ",05/09/2020,lysol
Oh do you need some bleach wipes having some Lysol wipes,05/09/2020,lysol
Q1 when my husband gets home from work I spray everything he touches with Lysol including bottom of his shoes and entire lunch box. #COVIDArthritis,05/09/2020,lysol
"Oddly enough to date the lowest priced offering has been the best . I have tasted Tang Powder , Cough Syrop , Burnt Roach etc Lysol etc",05/09/2020,lysol
Getting the office ready for grand re-opening! Thank god I have things on automatic renewal orders. #lysol #clorox #cavicide #handsanitizer there's a whole new look in the office thanks to covid19 @Pow-Her… https://www.instagram.com/p/B_-t1MGnTl3/?igshid=1lxoobw2g7j73,05/09/2020,lysol
"#tRump a #TrumpPileOfShit can not #TransitionToGreatness because #shit still stinks. Donald just pull down your pants and smell your ass, that smell is #ShitFromTrump. Not even #Lysol will fix #TrumpShit.",05/09/2020,lysol
NEVER EVER LET THEM OVER CHARGE YOU FOR PRINTING AGAIN!! WE PRINT STICKERS AND BANNERS OF ALL SIZES!! FREE LYSOL OR SANITIZER WITH 2 FLYERS JOBS OR MORE!! EMAIL ALL FILES TO idsprinting@gmail.com POSTCARDS 14 P.T.… https://www.instagram.com/p/B_-s8PSBXVe/?igshid=b49qd8hejozs,05/09/2020,lysol
George I say that every time I see him. He is the dumbest person ever! Capt Bonespur only uses about 50 words. His face when he realized Puerto Rico was an island was beyond stupid. How about his latest on shooting lysol into humans to kill Covid19. Just WOW!,05/09/2020,lysol
@Lysol I purchase a few of these. It’s smells really fowl is that Norma!? Your other products smell so nice! ,05/09/2020,lysol
maybe it’s because there are so many windmills out there or they didn’t take their chloroquine and Lysol or because we didn’t nuke a hurricane or buy Greenland or maybe it’s just because people are dying because you’re an idiot ,05/09/2020,lysol
"Oficialmente mañana cumplo 1 mes sin remojar la brocha con mi novia porque no estaba en el puerto, llega en 5 dias.... La voy a bañar en Lysol y no nadamas de eso XDDDD",05/09/2020,lysol
"“For some reason”, you moron? It’s a mystery, eh? Why DO people suddenly test positive for a disease? It’s a head scratcher! Probably forgot her Clorox injection & Lysol gargle, eh? ",05/09/2020,lysol
Got pepper spray? Say you thought it was Lysol.,05/09/2020,lysol
"Clarkson Pharmachoice now has Wet Wipes, Lysol Disinfectant Spray and Microban 24 Hour Sanitizing Spray! Come get some while quantities last! . . . . . . #staysafe #ontariopharmacy #lysol #wetwipes #Pharmacistscare… https://www.instagram.com/p/B_-msyvBwDX/?igshid=yu1v97hlr0dj",05/09/2020,lysol
It’s always Democrats who actually end up eating the fish tank cleaner and drinking the Lysol. It’s like close to a 100 percent tendency.,05/09/2020,lysol
Maybe they should try some lysol or some sort of light I'm not a doctor but it can't hurt! ,05/09/2020,lysol
While walking my pup she licked some guys leg I’m so grossed out. I can’t even Lysol her. lol I guess it’s bath time ,05/09/2020,lysol
@Chevron @KTLA price gouging at one of your gas stations here in la. Charging $20 for a can of Lysol when it’s $4 in stores. Filed a complaint but hope you investigate how your gas stations are price gouging during this crisis #chevron #ktla #pricegouging,05/09/2020,lysol
It’s contaminated use Lysol,05/09/2020,lysol
I'm just a simple man with a simple question. How long before some Governor's start flying bigass planes over us and just start Crop-dusting us with Lysol?,05/09/2020,lysol
People’s immune system trash for being locked up for 30+ days lol. All that hand washing and Lysol. No bacteria to help them fight off other viruses. I’m no doctor though.,05/09/2020,lysol
I wish we had hand sanitizers I wish we had Lysol spray I wish we had paper towels I wish we had toilet tissue I wish we had ribeyes on sale for $5at our stores But for one customer to bitch about not getting a cheesecake 2 for $6 is insane.,05/09/2020,lysol
"ORD is eerily empty... one person in front of me in line for security (no precheck open), and about 12 people at the gate. Everything is closed. Smells overwhelmingly like Lysol. Spooky.",05/09/2020,lysol
Hmmm should I take a can of Lysol w/ me when I pick up Luna from the airport... spray that bitch down before I hug her.,05/09/2020,lysol
"It’s the first glimpse of Charmin I have seen since this all began. Fortunately, I have always stockpiled toilet paper so it hasn’t been much of an issue. Have yet to see a can of Lysol or clorox wipes.",05/09/2020,lysol
GO DRINK YOUR KOOL AID AND LYSOL LOL ,05/09/2020,lysol
I hope that is for all of us. In a lot of this small town. I can't take Trump tell us we the Revolutionary War in 1776 by closing down our airports. What the HELL was that about? Is that like shooting up with Clorox and Lysol?,05/09/2020,lysol
I suppose she sent me enough masks for two pandemics. I could send her some Lysol.,05/09/2020,lysol
"ओलिज्म्, ट्रम्पिज्म् मा केही समानता भेटीयो। एउटा डा. ले Lysol इन्जेक्ट गराउने भन्दै थिए अर्का डा. ले दाल भात तरकारी र तातो पानीले कोरोनाको बोसियो तत्वलाई नास गर्छ भन्दिएछन्। ",05/09/2020,lysol
Lay off the Lysol,05/09/2020,lysol
Bihhh pandemic or not LYSOL!!!,05/09/2020,lysol
"Hide it or not, I think he should shove a high intensity UV light up his butt & then inject a bunch of Lysol. That'll take care of the problem.",05/09/2020,lysol
I spray a little Lysol in every room of my apartment every day. That would be a simple way to prepare the Oval Office. Also get a strong UV desk light to burn all night long.,05/09/2020,lysol
@FLOTUS recommends @Lysol for your after work Douche ,05/09/2020,lysol
NEVER EVER LET THEM OVER CHARGE YOU FOR PRINTING AGAIN!! WE PRINT STICKERS AND BANNERS OF ALL SIZES!! FREE LYSOL OR SANITIZER WITH 2 FLYERS JOBS OR MORE!! EMAIL ALL FILES TO idsprinting@gmail.com POSTCARDS 14 P.T.… https://www.instagram.com/p/B_-T48Thye5/?igshid=1dzp1i877z6yu,05/09/2020,lysol
NEVER EVER LET THEM OVER CHARGE YOU FOR PRINTING AGAIN!! WE PRINT STICKERS AND BANNERS OF ALL SIZES!! FREE LYSOL OR SANITIZER WITH 2 FLYERS JOBS OR MORE!! EMAIL ALL FILES TO idsprinting@gmail.com POSTCARDS 14 P.T.… https://www.instagram.com/p/B_-TB_XBl_A/?igshid=1ijxl2dsocoww,05/09/2020,lysol
What do you mean I can’t spray customers with Lysol,05/09/2020,lysol
Lysol ,05/09/2020,lysol
Spray the pizza box with Lysol ,05/09/2020,lysol
I wonder if the COVID people in the White House will be taking hydrochlororquine or drinking Lysol like the idiot Trump suggests??,05/09/2020,lysol
I just want Lysol wipes WHERE do I find them D.C.,05/09/2020,lysol
Just went to get some Lysol wipes from my dad but we couldn’t hug. ,05/09/2020,lysol
Lysol,05/09/2020,lysol
About midnight I started off just wiping off some water spots from the faucet in the guest washroom and ended getting out the mop and Lysol again and cleaning the entire washroom from top to bottom even though it was already spotless. #IsolationLife,05/09/2020,lysol
"@realDonaldTrump, don't worry about that dry cough you're developing. That fever you have...fake news. The stiflingly exhaustion you ask? Too much late night Fox News. Trouble breathing, it's all in your head. Take some Clorox orally, 1000 cc of Lysol IV and call me in the AM",05/09/2020,lysol
Is there any question? Hope someone has archived his dumbest statements. At this point I believe the injection of lysol/bleach for elimination of Covid19 is the best. ,05/09/2020,lysol
"Okay I just want to know, have y’all found any Clorox or Lysol wipes at all????? I can’t keep living like this if you have please tell me where!!!",05/09/2020,lysol
They are putting Lysol in their Kool aid.,05/09/2020,lysol
