Text,Date,search_term
U responding to me? Everything u said I agree with. Lysol jumped in that for publicity. I read the questioning and response back and forth if u took injecting or ingesting from what was said you r a moron or MSM.,05/13/2020,lysol
"I made my first Target run today since the beginning of March. They had a great inventory of all cleaning supplies, but still no Lysol or Clorox Wipes. Maybe try there?",05/13/2020,lysol
"Ok, I give up! Who has Lysol cans and wipes they’re willing to ship to CA for me?! Because I sure as hell can’t find any out here no matter what the fu*k time I go to a store and you can’t buy online so...",05/13/2020,lysol
I missed your smile and your Lysol spraying!!! Can’t wait to see you back at BMES! ,05/13/2020,lysol
Got me some Lysol today and my sanitizers shipped . I’m good . Just need some more purple cavi wipes ,05/13/2020,lysol
Of their fancy luxury boxes that are hosed with Lysol if they wanna feel RISKY,05/13/2020,lysol
I think you should set an example and swallow some lysol or that malaria pill you're so found of. Heil agolf twitler.,05/13/2020,lysol
I’ll come through with some Lysol and a bottle of wine ,05/14/2020,lysol
Offering Lysol probably bad - she might have drank it.,05/14/2020,lysol
Always gotta be ready for a beach trip.. now we carry a face mask and Lysol loll,05/14/2020,lysol
"Trump should be charged with crimes against humanity . Over 70 days golfing and rallying , calling covid19 a dem hoax. Dead grandmas and aunts and dads cousins sisters are not amused 70 days - 2.5 months ignoring science. Do you trust his daily updates? If you do, got Lysol ? ",05/14/2020,lysol
"It’s a joke, Sparky..no fans are allowed to go..im not protesting anything..get some Lysol on that caplock",05/14/2020,lysol
Imagine supporting a president who suggested ingesting/injecting Lysol into the human body ,05/14/2020,lysol
@GovRonDeSantis SENIOR HRS SHOULD NOT BE SUSPENDED. My gma went to @Publix #222 during senior hrs&amp; some 30-40 y/o man got in&amp; when she was reaching at the top shelf for 1 of the last 3 @Lysol products she asked him “can you pass me one?” He took all 3 &amp; said “ha no They’re mine”,05/14/2020,lysol
@FrancisSuarez @MayorLevine @MayorGimenez we should be further protecting our seniors as we open up not treating this like we are going back to normal.,05/14/2020,lysol
If it’s open for everyone the free for all and abuse our elderly population will receive will be similar to my grandmothers experience. To ADD to the already increased exposure. @MiamiDadeCounty @BrowardCounty protect our seniors and require hours for them,05/14/2020,lysol
Lysol has commercials like you can actually find it. ,05/14/2020,lysol
SENIOR HOURS SHOULD NOT BE SUSPENDED. My gma went to @Publix #222 during senior hours &amp; some 30-40 y/o man got in &amp; when she was reaching at the top shelf for 1 of the last 3 @Lysol products she asked him “can you pass me one?” He took all 3 and said “ha no. They’re mine”,05/14/2020,lysol
Oh ok ,05/14/2020,lysol
Damn you got a lot of orders that haven't shipped yet. I only got 3 lol,05/14/2020,lysol
i cant believe i’m typing this but the subway smells like lysol,05/14/2020,lysol
"Lady you are a #trumptard smothered in #Lysol. When you find your brain, simply fry it like an egg. ",05/14/2020,lysol
Exactly,05/14/2020,lysol
Ikr my Amazon Lysol purchase just says order received lol,05/14/2020,lysol
https://www.washingtonpost.com/politics/2020/05/13/what-does-it-signal-battle-house-if-republican-wins-californias-special-election/ Ana Lysol I saw hard or so to if malformation twashingto Post c caught up on Bouvier Homeland security camera Louis law go now,05/14/2020,lysol
I forgot most of my Lysol wipes and toilet paper at my other house.,05/14/2020,lysol
"I like mine chilled. shitheadsteve trashcanpaul _theblessedone grapejuiceboys barrysbanterbus fuckjerry @menshumor #winnipeg #manitoba clorox lysol #coronavirus #covid_19 #memes #coronavirusmemes @St. Vital,… https://www.instagram.com/p/CALoLzpDm-T/?igshid=1119to73qzgz3",05/14/2020,lysol
Hey I'm also @Hilton Gold!,05/14/2020,lysol
Clorox been restocking every week. The fuck is @Lysol doing with the spray yo? ,05/14/2020,lysol
"Did you drink the Lysol? If not, be my guest. And sacrifice two other family members while you’re at it. ",05/14/2020,lysol
"Yes, most of us are triggered that a serial lying, treasonous, forever impeached, racist, admitted sexual predator who is legally banned from operating a charity because he’s a crook is considered a God to the morally bankrupt right wing. Drink the Lysol. Please.",05/14/2020,lysol
"Donald Trump was not ready for this. He lies back tracks want you to put bleach,Lysol in your body he is really losing it.",05/14/2020,lysol
All purpose Lysol spray,05/14/2020,lysol
No. Nor any Clorox or Lysol product.,05/14/2020,lysol
Endless investigations? Last one resulted in #BenedictDonald being forever impeached for bribery and high crimes. I think you mean Benghazi which found no wrong doing you racist POS. Please drink the Lysol! 34% approval.,05/14/2020,lysol
What if I use Lysol or Germ-X? Is the name brand required? Have we attained corporate sponsorship?,05/14/2020,lysol
You mean they didnt try lysol inhalers and uv light enemas?,05/14/2020,lysol
How about Lysol instead. I'm done w them,05/14/2020,lysol
@VP @jaredkushner Please show graphics of those states that have met the CDC guidelines of 14 days downward trend in new diagnoses! I doubt many do. Please use the scientists to tell USA citizens. Your lies lose voters - or simply kill them . Just look how many drank Lysol !!!! ,05/14/2020,lysol
"Dumb Donald, hitting the Lysol",05/14/2020,lysol
1) I'd invite you to stop by and share the BJs size bottle we got a few months ago. 2) Shouldn't NY1 be providing this sending you out into the great unknown each day?,05/14/2020,lysol
There is a new product on the shelves. Trump brand vodka/lysol drink. Trumpacalypse Kool-aid. ,05/14/2020,lysol
Peter tiene que ir a hacerse un tratamiento de conducto urgente y creo que lo voy a dejar afuera remojando en Lysol cuando vuelva,05/14/2020,lysol
"This administration is unbelievable with their lies and bullshit... not one of them has the brains God gave geese, and are always blaming anybody and everybody but themselves.... if they all believe their buddy Donald they would all be sick from drinking Lysol , morons all.",05/14/2020,lysol
I freebase Lysol all day and do fat rails of Clorox to keep from getting the Rona. Trump is a god damn fool telling people to get some sunlight to help fight this deadly cold virus.,05/14/2020,lysol
Hospitals about to be poppin once everyone emerges from their Lysol bubble with no immune system,05/14/2020,lysol
There are other brands and people are spending their money buying disinfectants. Lysol is just reminding people to use their product. Spending money on marketing also provides jobs. ,05/14/2020,lysol
My life is all about constant lysol wiping.,05/14/2020,lysol
Moscow Itch should talk about classless his lousy leadership along with trump lousy leadership should talk about classless! Mitch and President Lysol have nerve the blame Obama for everything that goes wrong so who’s living in who’s head!He left69 page outline 4 DOTARD who tossed,05/14/2020,lysol
Just Cleaned My Bathroom On This Good Rainy Day ... Smelling Like Good #Lysol #Fabuloso #PineSol #Clorox #Febreze ,05/14/2020,lysol
Now I'm going to blame it on the doctors remember I said to inject yourself with Lysol you're ruining my pretending Legacy I don't care and if you notice today I said send the kids to school their young who cares if they get sick basically they won't the man is killing America ,05/14/2020,lysol
Where does it say bleach? Lysol? Yet y’all call other people deplorable and uneducated. ,05/14/2020,lysol
"I prefer him not working, thank you very much. When he works we get kids in cages and people drinking Lysol.",05/14/2020,lysol
Dr Bright is science and medicine. A highly respected expert versus a diabolical politician that told people to inject Lysol.,05/14/2020,lysol
"THANK YOUUUU!!!!!!! And covid maternity shoots, baby shoots with lysol next to them. Quarantine birthday stuff. All of it is so dumb to me like omfg. ",05/14/2020,lysol
Lysol?,05/14/2020,lysol
"I believe the comment by POTUS re Lysol is still #1 most reckless, but also high on the list is rebuking Dr. Fauci’s comments issuing caution in reopening schools. ",05/14/2020,lysol
"Trump now believes Fauci is wrong about his opinion re: early opening. Let's drink bleach & inject Lysol. T research test by Abb Labs used by t WH, is 50% accurate. Example why a rush to open, without an accurate test, is mass death. Fauci is right abt deaths are underreported",05/14/2020,lysol
"Also, if you are worried about exposure from mail, my friends and fam let packages sit for a while before opening or wipe the items down with Lysol wipes/disinfectant!",05/14/2020,lysol
"To help the Democrats out, because they’re the only ones who feel they have been commanded by our President to “drink Clorox bleach and inject Lysol”, these companies need to make self-injecting Lysol and Clorox single serving shot glasses. Give natural selection a little push.",05/14/2020,lysol
"Lysol so scarce .. don’t let me find a pack, I’m charging $100 a bottle",05/14/2020,lysol
"Lmao can you imagine strip clubs after this. They gonna be poppin that coochie looking like sun zero, but the men gonna be throwing those ones wrapped in Lysol wipes.",05/14/2020,lysol
That Tropical Punch Kool-aid laced with Lysol is good? Of course served in a signed autographed MAGA red cup with Trumps picture on it!,05/14/2020,lysol
"There are still grocery stores in MD that don’t have bleach, all types of lysol is gone in minutes (including toilet browl cleaner) but we’re opening up Friday (really started YESTERDAY) ",05/14/2020,lysol
"Nah...this is hardly making money off taxpayers and cashing in on the deaths of 85,000 Americans. But nice try. Tell me- - did you drink the Lysol? ",05/14/2020,lysol
All these years we could have been spreading diseases because we were using our own bags in the grocery stores? Is corona Virus on the back of Lysol cans since 2010?,05/14/2020,lysol
Supply & Demand 101 ,05/14/2020,lysol
Lysol! I’m sure I will be very welcomed ,05/14/2020,lysol
"My current hobbies include looking for quarantine survival items during late night nursing sessions. So far I have scored on Colrox Wipes, Hand Sanitizer, and Lysol. Currently seeking Wet Ones wipes lol",05/14/2020,lysol
Just drink your #Lysol and keep quiet! ,05/14/2020,lysol
i never saw hand soap or fresh produce out of stock. toilet paper was back last time i went to the store. lysol spray and wipes are still gonna be MIA for a while,05/14/2020,lysol
@Lysol Can Lysol make a disinfectant spray that actually smells good? I spray my masks overnight and it seems like the spray is worse than going without a mask.,05/14/2020,lysol
Gonna wake up at 6AM to be at Walmart when they open and try to buy some Lysol ,05/14/2020,lysol
"WE'VE changed. Throughout history, pandemics have come and gone, eliminating the weak and feeble, controlling the population and ensuring that we survive. We came a LONG way from Darwinism to ""wear a mask! Douche with Lysol! Stay inside! We have to save Nana! she's only 87!""",05/14/2020,lysol
U r crazy if u vote for trump! U need your head examined! Waltz has done great for us! Your selfish only care about yourself!! Screw others that maybe want to stay alive!! Go get sick! Get others sick too! Hope it makes u feel good! Drink Lysol with Trump you’ll be fine!,05/14/2020,lysol
"Before I say what I have to say, yes I believe at any moment I may get COVID-19, BUT I also believe staying in quarantine is making matters worse. Cleaning, spraying everything down with Lysol is only making our immune systems more susceptible to getting sick",05/14/2020,lysol
"History is unfolding right before our eyes. Capture it. #Lysol @Wellsville, Ohio https://www.instagram.com/p/CAJrC_sHhhi/?igshid=19y1sx7dr1zlu",05/14/2020,lysol
Also suggested that we drink Lysol to cure Covid 19 virus. ,05/14/2020,lysol
Time for Jr to have a Lysol cocktail LoL lol ,05/14/2020,lysol
Lysol cocktail time LOL ,05/14/2020,lysol
Time for him to have a Lysol cocktail LoL lol ,05/14/2020,lysol
Your Lysol/UV cocktail is showing... ,05/14/2020,lysol
I can’t wait for the day I can return home from training and not be attacked by my wife and her Lysol Aerosol Spray. ,05/14/2020,lysol
Lysol is dropping the ball man. I need my damn wipes and Spray ,05/14/2020,lysol
That's cold. Like Lysol into my veins. ,05/14/2020,lysol
"After this disastrous month that Trump has had, including his Lysol moment, the latest poll has Biden’s lead tightening in the national count, and him overtaking Biden, overall, in battleground states. Has this country lost its collective mind, or is Russia hacking our poll data?",05/14/2020,lysol
I never in my life thought that being able to order Lysol wipes would make me happy. Thank you Amazon. ,05/14/2020,lysol
Makes the Lysol go down Makes the bleach go down Oh a spoon full of sugar makes the hydroxychlorquine go down In the most delightful way Fine Print May turn you blue and die You’ll still have coronavirus,05/15/2020,lysol
Bro I just saw someone spray the chick fil a dude with Lysol when he handed the lady her change. YALL TRIPPIN,05/15/2020,lysol
Hello fam... been away for a bit... but still putting in work... the chicken breast is herbs and garlic... it was cool seeing toilet paper but now no lysol or wipes... lol... quarantine life... ... hope all is… https://www.instagram.com/p/CAOe3ASAunh/?igshid=zoc61vph91qb,05/15/2020,lysol
the one that just popped into my mind was the girl who was using Lysol wipes on her ass,05/15/2020,lysol
Real men and kids need a good ole injection of Lysol cleanser enema and a shot of Chlorine chaser for breakfast. ,05/15/2020,lysol
"@Lysol hey, it’s my birthday today, and nothing would be a better present then some disinfecting wipes. That’s the stage of quarantine we are in. Any chance you can make it happen.",05/15/2020,lysol
Who's president Lysol??,05/15/2020,lysol
Well getl aughed at or take a chance.Just spin the bottle or can when you finish your lysol an sugar.,05/15/2020,lysol
"“When you test, you find cases. If we don’t test, we wouldn’t have as many cases.” Are you out of your Lysol soaked, UV lit, sociopathic fucking mind? I am exhausted. #covid1948 #TrumpLiesAmericansDie",05/15/2020,lysol
Lysol,05/15/2020,lysol
It was a corona virus bug. The bug was tested for Trump virus. Been given Lysol and ultra heat rays. Prognosis “fantastic “ the best. No need for a test really,05/15/2020,lysol
It's right up there with drinking bleach and Lysol! ,05/15/2020,lysol
General Hardware off Peachtree has some. Limit 2 #lysol @General Hardware https://www.instagram.com/p/CAORuVInwPt/?igshid=1t55zaznqcpx3,05/15/2020,lysol
Covid is still killing people. Why oh WHY are y'all trying to overflow the parking lot? He loves you. From home. Keep your distance and wear the bloody masks. Stop touching everything. Lysol is the new pepper spray. I will use it. Not joking.,05/15/2020,lysol
Spray them with Lysol first fam.,05/15/2020,lysol
Still waiting for lysol mix vol. 2,05/15/2020,lysol
"It's going to have Lysol or Clorox in it. Just wait. Mengele liked the human experimentation way of doing things, too.",05/15/2020,lysol
"I’ve been thinking of buying wipes, soap and Lysol to take back to LA, right? Well my mama has already bought me those things and MORE. I’d love for her to stay outta Walmart but Im thankful. We’re now calling her the coronashopper",05/15/2020,lysol
you want to keep him safe have him inject some Lysol that'll keep him safe Fry's you voting green care less how you roll that dude is gone ,05/15/2020,lysol
"If it’s Lysol injection you can have it with some Covfefe and a sting bright light up your, you know what. B yatch. Liar. Female Judas. POY.",05/15/2020,lysol
Versus a quick wipe with a lysol wipe between customers? Which still needs to be done,05/15/2020,lysol
Um... folks. I generally boycott Walmart but http://instok.org pointed me there today. Act fast and you can get Lysol and hand sanitizer shipped: ,05/15/2020,lysol
Magic Eraser? Lately I like adding a little original Lysol to Murphy's Oil Soap solution. Seems to clean anything you want to still have a bit of shine on. Bleach OR Vinegar on other stuff.,05/15/2020,lysol
Interesting!,05/15/2020,lysol
Thank you my friend! *wipes mug with Lysol wipe and washes hands before chugging*,05/15/2020,lysol
"Omgee, guess who's blessed with Lysol today? Meeeee #iStillBelieve #iAMstillHere #CoronavirusFREE #HeCanHealTheLand #ThisToShallPass @Manhattan, New York https://www.instagram.com/p/CAODvk9A4g5/?igshid=14hywbhvszay0",05/15/2020,lysol
I come with facts and science and you respond with conjecture and bullshit. We should probably inject Lysol into our lungs or stick UV lights up our asses; that might help.,05/15/2020,lysol
"I just wanna know if folks can’t find Lysol, bleach, etc on the shelves, why exactly would you be hoping that salons/barbershops are opened without that?",05/15/2020,lysol
"Parte de mi, muere de pena cuando alguien llega a mi casa por que los baño en lysol jajaja pero pues covid jajajaja",05/15/2020,lysol
Captain Lysol I like that one!,05/15/2020,lysol
Ojalá traigan Lysol,05/15/2020,lysol
What if we just carry cans of Lysol and spray if anyone comes within 6 feet instead?,05/15/2020,lysol
"On my way to school to grab some caps and gowns for our great seniors! See some of you soon! (Mask, Lysol wipes and hand sanitizer is at the ready... and the car will be in park for any tweets or videos sent out) @RJohnson_LSCHS",05/15/2020,lysol
hell nah I found Lysol wipes,05/15/2020,lysol
Le puse Lysol a mi cubre bocas de tela y ya me andaba Moneando machin... ,05/15/2020,lysol
Made with Lysol and bleach,05/15/2020,lysol
"The moment he suggested injecting Lysol into our bodies should have been a wake up call. But you ignorant gaslit Trump followers let your egos override common sense. Study up on gaslighting, until then you are muted.",05/15/2020,lysol
Well I expect sales of Lysol will rise also or is the 2nd wave going to curable by another one of his foolish claims - eating clay from the forests of Rainment on a full moon at exactly 12:03,05/15/2020,lysol
Lysol down them swings,05/15/2020,lysol
"Trump didn’t know the difference between Medicaid and Medicare, he’s trying to eliminate protections for pre existing conditions in court and suggested injecting Lysol to get rid Coronavirus. Can we get someone else to update us on vaccines? Someone trustworthy?",05/15/2020,lysol
Lysol will be served.,05/15/2020,lysol
"You know you’re in the middle of a pandemic when your car gets broken into and they steal your dogs blanket, your lysol &amp; PPE #ldnont",05/15/2020,lysol
Whoever left a new pack of Oreos at my job.. THEY COMING HOMEEEE.. after I spray Lysol on them,05/15/2020,lysol
Wait...y’all didn’t know all these quaranteenagers are sneaking out and huffing Lysol aerosol cans while ironically watching the anime Bleach? ,05/15/2020,lysol
#TrumpHasNoPlan which makes him great in the eyes of his MAGA Lysol swilling followers #TrumpsAmericanGenocide,05/15/2020,lysol
Trumputin should have a Lysol cocktail party to celebrate lol ,05/15/2020,lysol
Jr have a Lysol cocktail and stop your lying ways ,05/15/2020,lysol
Time for Jr to have a Lysol cocktail LoL lol ,05/15/2020,lysol
Yup same with Lysol spray Tylenol Clorox bleach disinfection wipes and don’t forget toilet paper and now meat shit is getting real ,05/15/2020,lysol
Well friends hope all are well. Went to store to hunt down the elusive animal. Clorox wipes. But alas all out again but low and behold there in front of me lysol. I huntedi won. Have a great day. ,05/15/2020,lysol
"I started stocking up medical supplies ,even food , PPE, wioed, Lysol, etc in JANUARY just based on reading foreign press, many nurses/ Drs did too &amp; it made no difference, we were called ""fearmongers"" because of the government silence &amp; cover up. #COVID19 #pandemic #PPE",05/15/2020,lysol
"How do you know they are explosive? You know what is explosive- Pontius Pilate Trump thinks by decreasing testing, the number of positive cases would be less. All Trump supporters should volunteer to be injected with Lysol or any disenfectant. If not possible, how about lights!",05/15/2020,lysol
What the facts are on #teatree #EssentialOils and #COVID19 #coronavirus https://www.superfoodly.com/is-tea-tree-oil-antiviral/ #Antiviral #lysol #PPE,05/15/2020,lysol
Misery is lowkey contagious spray dem negative hoes like Lysol ,05/15/2020,lysol
Unless Amazon is restocking Lysol and Clorox disinfectant wipes I can’t think of one thing I need from Amazon... maybe a book a 2 but that’s what the library is for ....,05/15/2020,lysol
That's awful! Sad to hear people taking advantage of people. That young man with get what's coming to him one day!,05/15/2020,lysol
Probably nothing that could rival the pull it out if your butt laughable Lysol and light treatment brilliance that oozes from you as you entertain yourself with words as an actual deadly pandemic runs amok.,05/15/2020,lysol
Lysol cocktail hour ,05/15/2020,lysol
"@realDonaldTrump Your FDA warned about false negatives today while you congratulate your idiot self. You didn’t have 5 “friends” that died, you lost 5 ASS KISSERS. now go drink some Lysol and grab a pussy.",05/15/2020,lysol
Anyone with half a brain would listen to Dr. Fauci and not the Lysol ingesting UV light stuffed where the light don’t shine President,05/15/2020,lysol
The Lysol factory still didn’t send em out,05/15/2020,lysol
"Chino dame una agua en bolsa y un tortrix Ahhhh y 2 libras de lomito, un cartón de huevos, 1 Lysol, 1 litro de leche Lala, 2 botes grandes de Palmolive, 1 ensalada en bolsa, un pollo horneado, un fardo de papel higiénico y dos cigarros Donde tenes el pos de tarjeta?",05/15/2020,lysol
Says the dummy whose father suggested we all drink Lysol to stay healthy.,05/15/2020,lysol
Words cannot convey my gratitude . My bestie from Maryland surprised me with 2 large containers of Lysol antibacterial wipes . A friend gifted her a 5 pack and she sent me 2. I am overwhelmed . They are nowhere to be found in my area of NC . More precious than gold right now,05/15/2020,lysol
I think it’s fair you warn them about the lysol cans in your pillow case first,05/15/2020,lysol
"Lysol Donnie, stop trying to deflect and redirect, this is much ado about nothing. Let's focus back on the pandemic and your taxes, Deutsch Bank and Russia. Everyone knows you have had more indictments and jailed inner circle cronies than any President. SMFH #gottago2020",05/15/2020,lysol
We could walk around and just spray people who get to close with Lysol ,05/15/2020,lysol
"Better yet a Triple H (high, heavy & hot as hell) Lysol Disinfecting Enema! ",05/15/2020,lysol
"Anywho, I got some Lysol disinfecting spray on amazon the other day. I felt like I won the lottery....",05/15/2020,lysol
my grandma always makes the best goody bags when I leave her house @Lysol @Clorox @Microban SPONSOR HER SHES STOCKED THE HOUSE (btw the microban stuff is AMAZE) my house&amp;soul is happy ,05/15/2020,lysol
"Specially when they can't send enough stock to the stores, always out.",05/15/2020,lysol
"@realDonaldTrump ""I don't know him never met him"" Is that what you say when ever you get rid of someone. Listen President Clorox and VP Lysol you are going down in November @TeamTrump @senatemajldr Mascow Mitch say goodbye The president who should not be named R going down – at Shell",05/15/2020,lysol
Let me know when they restock . I need them more than Lysol https://twitter.com/Asante777/status/1261175150256553985,05/15/2020,lysol
"You can say that again! I'm really worried that there are so many people still backing and believing him! I'm incredulous that people believe he's a good guy. Do they even watch the news? Now, would you excuse me? I have to go wind down with my glass of Clorox and Lysol.",05/15/2020,lysol
@MikeBloomberg @Mike2020 I’m hoping you’ve been planning the ultimate attack on Trump with your . Here is a billboard you need to put up in all states across the USA along with other quotes like the Lysol one...and the stuff he says to reporters. #bloomberg #Election2020,05/15/2020,lysol
What happened to the lysol trucks?? They never did that here in the States,05/15/2020,lysol
Lysol is an disinfectant.,05/15/2020,lysol
"Better don’t use mask .!!! drink Clorox or Lysol, or fill yourself with self confidence and became a Maga Warrior or Kega warrior with your pocket full with HYDROXYCHLOROQUINE. ",05/15/2020,lysol
Did they try the bleach or Lysol?,05/15/2020,lysol
“lysol in the ol arteries”,05/15/2020,lysol
@realDonaldTrump can there be anything done about price gouging? 1 can of lysol spray on eBay for $129. eBay just sent me a link. I sure hope people realize people like me WILL report your price gouging... haven’t we ALL been though enough?!,05/15/2020,lysol
"U ndo everything Obama. All legislation. Climate denier replaced climate change. Clean Air and Water replaced by fracking. Completely ignoring Obama's detailed pandemic playbook. Trump sold bleach, lysol &amp; rushed an inaccurate COVID19 test to market. Vaccine in 2020? Clueless.",05/15/2020,lysol
So no injecting Lysol?,05/15/2020,lysol
