Text,Date,search_term
Just thinking. If I would have thought to invest in a mini Lysol drive through stand I’d be a young rich black girl rn.. dang ,05/19/2020,lysol
Lol girl just bring yo Lysol and mask ,05/19/2020,lysol
I guess @realDonaldTrump gave up on drinking bleach and Lysol.,05/19/2020,lysol
Let him take as much as he wants. How about a Lysol chaser?,05/19/2020,lysol
Take it & inject Lysol while you're at it ,05/19/2020,lysol
lol 22...5182020... ...injecting Lysol will not disinfect your body... ,05/19/2020,lysol
"I just got home and got out of my car to spray my mask with Lysol, forgetting how windy it was, so the Lysol came right back into my face ",05/19/2020,lysol
Good god just take your lysol and bleach injections and call us in the morning,05/19/2020,lysol
Oh and Trump's handling of the Virus telling people to inject lysol and bleach and communicate with Putin in secrete withhold military aid to get his way to make Biden look bad...boy you must like kissing Trump's ass...gosh isn't that just like a Trumper blind leading the blind,05/19/2020,lysol
Got to order some wipes on Amazon today thank god. Now I just need the Lysol to come back in stock. And I’m mad you gotta just order them one time pay the shipping.,05/19/2020,lysol
"Trump ""shocks the world"" by going completely bald, then dropping dead, after drinking Lysol and taking Cholohydroxiquine !",05/19/2020,lysol
Some times brother you just can't fix stupid and this moron is way beyond fixing so I agree pump him full of Lysol so someone who unfortunately has the virus ( and they know it's not a hoax) can get help so they can recover and spend more time with friends and family,05/19/2020,lysol
How about injecting Lysol and bleach too! ,05/19/2020,lysol
And chase it with a bleach/Lysol chaser!,05/19/2020,lysol
Great start Donny with the drug you have been promoting endlessly and finally taking it. How about starting with Lysol injections and shoving UV light into the body. Please do them on Live TV? You will have the greatest ratings ever recorded in the history.,05/19/2020,lysol
More likely they're giving him lysol and telling him its quinine.,05/19/2020,lysol
And Drinking Lysol,05/19/2020,lysol
"On the market 24 hours and I’ve already used an entire can of Lysol. This better sell fast, I only have 3 more cans!! ",05/20/2020,lysol
Mi mamá y yo estamos en una guerra. Ella quiere bañar en Lysol a mi almohada preferida (la tengo desde que nací y ME NIEGO a que le deje ese olor) así que la escondo cada vez que salgo del cuarto y ella me escondió el secador del pelo porque no quiere que me lave el pelo,05/20/2020,lysol
Lay off the Lysol he is obsessed ,05/20/2020,lysol
#Amazon #Wont #Sell #Me #NO #LYSOL #NOR #CLOROX nor #7th #GENARATION,05/20/2020,lysol
#trumpdisinfectant #vaccine #trumpintoronto #lysol ,05/20/2020,lysol
#Lysol/Clorox #disappeared #From #THE #COLORED #PEOPLES,05/20/2020,lysol
Thanks! I got my Receipt of When you Actually $took #Lysol/Clorox,05/20/2020,lysol
To #SEE #LYSOL nor #CLOROX #in #OVER #3MONTHS.,05/20/2020,lysol
"#ED is common at his age. Maybe he's mixing Viagra with his hydroxychloroquine and Lysol. #TrumpMorbidlyObese but when you're in it for pay, that is overlooked.",05/20/2020,lysol
Gonna spray Lysol into the air vent ,05/20/2020,lysol
"I stocked up on baby wipes, Lysol, vinegar, bleach tabs. You can still get baby wipes. I pour Lysol into the package, use it to wipe off groceries. I found prof (?) grade alcohol, vinegar. Also, Dial Gold kills most germs. Eyeglass lens wipes work for emergencies.",05/20/2020,lysol
Not enough Lysol in the world..,05/20/2020,lysol
My daughter works at CVS at college. She bought us 6 large Lysol wipes at the beginning of this crisis before her college closed down,05/20/2020,lysol
What I was never doing was paying $20 for Lysol y’all crazy as hellll,05/20/2020,lysol
"Midday trip to Costco on a Wednesday. All about timing I guess. Lysol, alcohol, disinfectant wipes, and a $9.99 bottle of hand sanitizer were in stock. .. #costco #costcofinds #covid19 #handsanitizer #lysol… https://www.instagram.com/p/CAbK8gGjPtY/?igshid=fiu4cmqb537g",05/20/2020,lysol
Make sure you lysol it,05/20/2020,lysol
Dear @Lysol these @DollarGeneral &amp; @FamilyDollar employees in Buffalo are hiding and hoarding your products for themselves ... The general public can’t buy any because they have it all... they won’t even unbox it when the trucks come ... HELP,05/20/2020,lysol
No Lysol?,05/20/2020,lysol
"Took advantage of the rain today, can’t work outdoors, I’ve swept, mopped, cleaned bathrooms, microwave. Vacuumed, Cloroxed, Pine Soled, Lysol’s, Windexed the whole House. Company coming! ",05/20/2020,lysol
https://www.motherjones.com/media/2012/03/when-women-used-lysol-birth-control/ @Lysol #really,05/20/2020,lysol
"The lower IQ crowd heard drink bleach and inhale Lysol. Rob continues to show where he rates. If he gets sick, deny him hydrochloroquine.",05/20/2020,lysol
I sprayed some Lysol on my multi-vitamin this morning so I’m definitely not getting sick.,05/20/2020,lysol
Every time I go into the bathroom at work I have to Lysol the whole toilet. How fucking hard is it to keep your anus off the seat and above the water.,05/20/2020,lysol
"The less intelligent heard drink bleach, breath Lysol and had to be told not to do it. The more intelligent already knew, or did research and learned, that there are medical grade ‘disinfectants’ already being used to treat cancer effectively and being studied to treat viruses.",05/20/2020,lysol
I’m at the doctors office and these nurses in here cheering cause they finally got some Lysol in ,05/20/2020,lysol
Them Lysol injections got me feeling fresh ,05/20/2020,lysol
"Why are so many “essentials” still sold out? No Clorox, no Lysol. But why is the Windex sold out too? Rage cleaning glass now? Wtf it’s not antibacterial, and I know that’s news for some of you. (Yes I know antibacterial version exists, I’m talking about the old blue one)",05/20/2020,lysol
"Respectfully, concentrating on recovery only empowers deniers! “I’m taking hydroxychloroquine “ (effective on protists). “How about injecting Lysol? Or getting light inside the body?” “One day it will just magically disappear”. “I won’t wear a mask”",05/20/2020,lysol
"Never lose your keys again! Wear them on your wrist. You can wash this bangle, lysol wior it, dishwasher it, just whatever you want to do to it. https://loraleisonmain.com/products/bangle-babe-key-ring @… https://www.instagram.com/p/CAavbCoFC_A/?igshid=1q4nfijgx1wi0",05/20/2020,lysol
Desinfectalos con toallitas lysol,05/20/2020,lysol
You drank the Lysol. I am a real Bible believing Christian. #staywoke,05/20/2020,lysol
But the same people who eat tide pods also ingest bleach & lysol. So we wont be hearing much from them,05/20/2020,lysol
I don't care if Trump takes Hydrochloroquine or Clorox or Lysol. Do you?,05/20/2020,lysol
"Everybody talking about how you’re not gonna get COVID from packages hasn’t seen my mailman roll up smoking a cigarette and smashing a burrito before he bare-hand wipes his mouth, tosses his cigarette, and then puts a box on my front step. Imma Lysol, thanks. #JustSayin",05/20/2020,lysol
"You are making the case for a new party, Bill. This centrist will never move back to the Lysol Party.",05/20/2020,lysol
"Too late for the Lysol Party, Anthony.",05/20/2020,lysol
"So, we have nearly 30 percent of Americans who are willing to drink Lysol? Ok. Got it.",05/20/2020,lysol
First of all she didn’t even mention Lysol. If Donald Trump turned around to the person on his right and ask them if disinfectants could be injected. The whole world heard it except apparently you. Anyone who defends Trump needs professional therapy ,05/20/2020,lysol
Lysol shaving cream? Bet that hurt! ,05/20/2020,lysol
"I swear to God all I want is a can of freaking Lysol, That is all. World peace would be good too, But damn it right now all I want is a can of Lysol! Bet I could find one on the internet for 20 bucks,fuck it,I'm going hunting ",05/20/2020,lysol
"Hmmm... so, by your account, Trump is in bed with China. Not only do his family businesses depend on Chinese labor, but he, too, points fingers at others, trying to deflect/reject responsibility. Hmm. Does Trump semen taste like Lysol?",05/20/2020,lysol
Critizing Biden for speaking badly. Why did Trump have to quit blabbering about hydroxychloraquine and lysol? Because he was ruining his own ratings. So he turned to stoking his base with paid nutbars.,05/20/2020,lysol
Trump can take birth control pills with Lysol and I wouldn’t care; however I do care about this country...he has to go. #anyonebutstupid,05/20/2020,lysol
"The HCL diet. Hydroxychloroquine, Chlorox, and Lysol.",05/20/2020,lysol
"Maybe you should just do what the IdiotPOTUS says and try a little Lysol or something! Woman dont shut up because a man speaks anymore, so why dont uou ho learn something!",05/20/2020,lysol
"When you arrive at a desk, you're going to see hotel staff wiping the desk clean in front of you even though there's nothing on it."" More Lysol, no more pens in rooms. Hotels adapt to win back guests https://www.mprnews.org/story/2020/05/20/npr-more-lysol-no-more-pens-in-rooms-hotels-adapt-to-win-back-guests via @mprnews",05/20/2020,lysol
Okay I see what's up now. When y'all want to sell goods to the Hood y'all call @SnoopDogg to speak for your products. Cool! Get that Guapo #Snoop. At least Snoop won't have his people drinking @Clorox are @Lysol. Probably have yo ass smoking some heat!,05/20/2020,lysol
"Come on man, don't take odd drugs or drink clorox and LYSOL.",05/20/2020,lysol
"Beso, querido. Toma precauciones, vives en Nueva York. Bueno, el es el mismo aquí y allá (realmente internacional el no-bicho).Tú rocíate Lysol en los zapatos antes de entrar a tu casa. You must!",05/20/2020,lysol
"I don't believe he's taking those pills. Remember he's a pathological liar. He wants other people to take it. Doesn't he own part of that company?. If he is taking it, he has to drink I with a side shot of Lysol so it really really works. ",05/20/2020,lysol
"Yes, because he was the President during last epidemic . He has prior knowledge how to handle a crises. He will not inject himself with Lysol or take an unapproved drug.",05/20/2020,lysol
I’m a Lysol man myself,05/20/2020,lysol
"As a sick person with a mom with cancer at home who hasn’t gotten sick because I’m remaining in my room and when I go out of it even it’s inside the house I wear my face mask and spray Lysol all the way I go, I think somehow it helps ",05/20/2020,lysol
"If we had a smart president, we wouldn’t have had to listen to Trump hawking hydroxychoploroquine, or fantasizing about injecting his butt with Lysol.",05/20/2020,lysol
Yes and Lysol to!!,05/20/2020,lysol
Going to take a lot of Lysol and Bleach for that job. An exorcism is highly recommend also,05/20/2020,lysol
"""alcohol prep pads"" oh u mean the lysol wipes for my phone",05/20/2020,lysol
"Drinking Lysol again, Matt? Stick to Vodka. It doesn’t have a stench nearly as bad as your tweet. ",05/20/2020,lysol
"Marsha, Marsha, Marsha...did you drink the Lysol again? Nice try but these emails prove the opposite of what you’re pushing. Where was the outrage when Trump tried to extort a foreign country to the interfere in our elections? History will not be kind to you. ",05/20/2020,lysol
"Please, please, please keep taking HCQ! Don't stop Tubby -- don't listen to the damned FDA or CDC! Lots of adverse side effects! Inject some Lysol. What do you have to lose???",05/20/2020,lysol
Why are you trolling those of us who are wise enough 2 see the demented damage that the orange menace is doing to our country. Go off and pay attention to your own business. We are smart enough to not drink Clorox or Lysol or take hydroxichloroquine. He’ll sell u out for 10cnts,05/20/2020,lysol
Dang where you at Bc Florida don’t have Lysol at all,05/20/2020,lysol
my gym opened back up I’ve only lost 10 pounds since it shut down I can’t wait to get back to it Ima bring my own Lysol to spray everything down though ,05/20/2020,lysol
"No pido nada a domicilio, pero todo lo que compro e ingreso a mi casa lo desinfecto; el cloro, gel antibacterial y lysol son mis mejores amigos y cuando salgo uso cubrebocas, guantes y careta o al menos anteojos tipo goggles, hasta a mí perrito desinfecto si sale.",05/20/2020,lysol
"@realDonaldTrump is doing @obama a favor by not forcing Obama to have witness in person Trump carrying a flashlight up his morbidly obese *ss, drinking bleach with his donuts and chasing it down with Lysol and snorting Adderall in between popping chloride pills. ",05/20/2020,lysol
I dreamed that 2020 was going a lot differently. Like I could hold hands and hug random people without having to quarantine myself for 2 weeks with them first. Then I woke up and Lysol sprayed the air because someone walked too close.,05/20/2020,lysol
He took 2& lysol cocktail,05/20/2020,lysol
Which word? #Hydroxychloroquine or #Lysol?,05/20/2020,lysol
I cleaned obsessively and sprayed Lysol on everything before this pandemic and ppl just laughed at me and called me “obsessive compulsive”. WHO THE FUCK IS LAUGHING NOW?,05/20/2020,lysol
I almost sprayed her ass with Lysol,05/20/2020,lysol
" Just a spoonful of Lysol helps the hydroxychloroquine go down, the hydroxychloroquine go down the hydroxychloroquine go down! Just a spoonful of Lysol helps the hydroxychloroquine go down In the most delightful way !",05/20/2020,lysol
" Just a spoonful of Lysol helps the hydroxychloroquine go down, the hydroxychloroquine go down the hydroxychloroquine go down! Down the most delightful way !",05/20/2020,lysol
"My buddy had a homeowner tell him to NOT to GET more than 6’ from the house as the homeowner came at him, OH! And the people that Lysol the air on their porch as I return to my truck. How’s your morale?",05/20/2020,lysol
I’m doing awesome. Our baby Yoda arrived after waiting 5 months. The package said made in China. So I’ve dosed him with Lysol. Did you resolve your customer service phone call issue yesterday? ,05/20/2020,lysol
"Ted, have you been drinking Lysol today? Oh, and how do you defend a man who called your dad a killer and your wife a dog? ",05/20/2020,lysol
Much Clorox and Lysol will be needed.,05/20/2020,lysol
NO. NURSES AND DOCTORS ARE NOT TAKING HYDROXYCHLOROQUINE. MOR ARE WE TAKING BLEACH OR LYSOL.,05/20/2020,lysol
Just posted a photo @Tibet Butler Preserve https://www.instagram.com/p/CAY-PpmAJ3f/?igshid=jnqlpwbdzeon,05/20/2020,lysol
Of course @realDonaldTrump's cabinet is backing in his use of #Hydroxychloroquine. I'm also pretty sure they're hoping he asked for more along with a nice cool chaser of @Clorox mixed with @Lysol. Maybe #Trump's cabinet is secretly conspiring to save the country? From them.,05/20/2020,lysol
What if he came out with a glass of Lysol &amp; a match. Would that be http://fake.At least that follows one of Trump's half-assed brain spasms. What proof do you hav that it was fake. At least he is following the guidelines expected of everyone. Unlike our prez,05/20/2020,lysol
The CDC said a mask does not prevent u from getting Covid 19 so y is the CDC and governors forcing us to wear a mask. U can still breathe it in so if a mask like lysol isnt 100% then y wear a mask,05/21/2020,lysol
Pos said he wont close down even if there is a 2nd wave. Bc then mail in ballots would be requisite... he also knows he can get his cult to drink the lysol and vote but most of us r educated re dangers of this virus,05/21/2020,lysol
New product stocked on #Tuesday. #plantbased #lysol ,05/21/2020,lysol
"You are right that's what he said! Pray that his followers drink lysol and Clorox, we will have an advantage. Then his followers will die and we will win. I can't for the first person who will heed his advice it was let us win.",05/21/2020,lysol
It’s not their job to get you reflected. It’s up to you and your record. Not that any of them@are being fair and unbiased. But that is the time if the need. Report facts. Line hue injecting Lysol is worth investigating ,05/21/2020,lysol
I just use Lysol lemon scented spray when I clean or the Clorox spray. It’s hard trying to find Clorox wipes right now. Smh,05/21/2020,lysol
I'm not going into business which looks careless with my health. Masks on. Multiple times a day wipedown of surfaces with soap and water followed by disinfectent. That squirt lysol is not enough. Frequent handwashing. Maximum occupation. Social distancing.,05/21/2020,lysol
If you cough in my face like this be prepared to have your face full of Lysol because I’m spraying that right in your mouth ,05/21/2020,lysol
" Just a spoonful of Lysol helps the hydroxychloroquine go down, the hydroxychloroquine go down the hydroxychloroquine go down! Just a spoonful of Lysol helps the hydroxychloroquine go down In the most delightful way !",05/21/2020,lysol
Poor Republicans keep on throwing that spaghetti and injecting that Lysol and take that drug what its called hydroxychloroquine ,05/21/2020,lysol
Lysol the Oval Office lol ,05/21/2020,lysol
They need to give you a bottle of Lysol not water,05/21/2020,lysol
Yall been to a Walmart lately...empty meat shelves...no Lysol not even in CVS Walgreens...2 months...dafuq yall trucking sunshine and good vibes? Only steady supply been dank and booze. ,05/21/2020,lysol
Lord she spraying Lysol like air freshener. I’m bout to die,05/21/2020,lysol
"@BillGates as a sidelined cottage industry of thecovid-19 era ..I'm inventing USPS envelopes Fort Mead.. which discourage virus growth and disease spread. I call these Covid-19 resistant envelopes.. ""Lysol-Velopes"" .. if I could get your , Rory or #BAMGF help with Angel Funding",05/21/2020,lysol
Saw another warning today about cleaning solvents etc; I taught for St. John Ambulance in Toronto many moons ago- Never did I teach flushing veins with lysol for anything . Can you imagine ! How stupid is that moron!,05/21/2020,lysol
"Put it in a basement supply room, the one with all the Lysol.",05/21/2020,lysol
Lysol disinfectant spray to the dome lol,05/21/2020,lysol
I’m just waiting for him to hork up a lung at the end of one of these things. “That’s just the Lysol cleaning out my lungs. Doing it beautifully.”,05/21/2020,lysol
I'm thirsty again and have some neighbors who could use a beverage as well. Can we get some more @budlight in these tough times? I prefer to avoid lysol ,05/21/2020,lysol
imma start carrying a can of Lysol with me so if some ignorant ass tries to “cough” on me I’ll whip it out and hit em back with a tsunami of disinfectant. ,05/21/2020,lysol
should i spray rebeca with lysol before she comes into my house ,05/21/2020,lysol
Thank you love I’ll keep that in mind,05/21/2020,lysol
Orange Bin Lysol?! Y’all gotta stop hitting that man like that lol... he has a wife and children bruh,05/21/2020,lysol
So @Lysol just NEVER gonna restock? Did their factories shut down? are they not essential? I am so confused,05/21/2020,lysol
This is what E Bay asking for.For a can of Lysol spray. ,05/21/2020,lysol
Seems like he’s getting dumber every time he speaks. Wonder if it’s the bleach and Lysol he’s drinking or the hydroxychloroquine?? #NotMyPresident #wackadoodle,05/21/2020,lysol
I think gin will work too @Tanquerayusa . Fend sumtin’ off . Kudos Tom on BR work.. @Lysol,05/21/2020,lysol
Chew on these delicious lysol wipes! As recommended by POTUS eat disinfectant wipes and drink hand sanitizer to rid of the RONA! sprinkle Splash Gotcha covered and you won’t need to call poison control after eating… https://www.instagram.com/p/CAdRNMJpJ8u/?igshid=flih460pc7yl,05/21/2020,lysol
"Me: mom, que dijo el padre? My mom: Lysol. ",05/21/2020,lysol
Yes! We have Clover systems and they say Clorox and Lysol wipes are okay but using the straight Lysol disinfectant on the screens is not recommended. @DennisonDepot #OHMuseumChat,05/21/2020,lysol
And chlorox and Lysol stocks tank ,05/21/2020,lysol
Hey do you also have the mystical power to produce Lysol? ,05/21/2020,lysol
"Man we've got like baby wipes all over town but they don't disinfect anything I do have one package of alcohol wipes, But I had six and they are slowly dwindling away Lysol has been nowhere to be found since the lockdown, Now that's something I wish I would have hoarded ",05/21/2020,lysol
You said Trump was being sarcastic in reference to Lysol injection. Apparently you don't know the definition of sarcasm.,05/21/2020,lysol
Did they just spray Lysol ,05/21/2020,lysol
Yeah it’s a good deal. Is it new or used cause if it’s used u might have to spring the extra $50 for a can of Lysol lol,05/21/2020,lysol
Lysol chaser for the one-two punch.,05/21/2020,lysol
brand partnerships are now like are you clean? or are you clean clean? United + Clorox = United CleanPlus Hilton + Lysol = Hilton CleanStay ,05/21/2020,lysol
"The president added that his doctors say the hydroxychloroquine is only effective if taken with 8 ounces of Lysol, and the White House is out of bleach.",05/21/2020,lysol
There are people in Brooklyn area selling Lysol sprays for $25 a can... Smfh I asked for the price and never Got Tha Fuck On so quick in my entire life. ,05/21/2020,lysol
"Besides normal stuff like rent, car payments, car insurance & utilities I’ve been obsessed with buying masks, hand sanitizer, alcohol, Lysol, disinfectant wipes etc. after my wife got Covid I have become obsessed with making sure we don’t run out of those things",05/21/2020,lysol
"In early March we purchased 2- three packs of @Lysol and since then I have run out and am looking everywhere online and at stores however it can’t be found. @Lysol, can you recommend where to purchase? #lysol",05/21/2020,lysol
niggas bringing lysol to-go to the functions all 2021,05/21/2020,lysol
No no @realDonaldTrump. Double it up and wash it down with Lysol on the rocks.,05/21/2020,lysol
maybe he’s switching to light and Lysol now ,05/21/2020,lysol
I wouldn't...maybe add the Clorox + Lysol injections? ,05/21/2020,lysol
"this ignorance right here. this misogynist, antiBlack ignorance right here. Kamala Harris is the only choice. new voters need to get fired up about not dying under a morally bereft, fatally moronic, bigoted AF dictator who thinks Lysol lung injections are a bright idea. ",05/21/2020,lysol
"I know, right? Like Dawn & Lysol!",05/21/2020,lysol
He should try the Lysol latte regimen next ,05/21/2020,lysol
GIVE IT UP FOR MC LYSOL!!! BUR BUR BUR BURRRR!!!,05/21/2020,lysol
Germs ? Oh no ! I need to go take a shower and wash with Lysol -again !,05/21/2020,lysol
Lysol: “oh well we rode that wave into the millions ” ,05/21/2020,lysol
"Good point. He can wash it down with some Lysol, for all I care.",05/21/2020,lysol
"Finally bought supplies to ship home! Man, hand sanitizer (1-per person), handwash soaps and other over-the-counter medicines are so pricey! Still have not found any Lysol or Clorox wipes, ugh! But, sending this home is priceless! ",05/21/2020,lysol
Laa desinfecté con lysol pa que no se contagien ,05/21/2020,lysol
Walk in front of him spraying Lysol. ,05/21/2020,lysol
True Because our testing and federal leadership has been absolute shit This kind of fear wouldnt have become so widespread if there was an actual leader in the White House. Speculation about the efficacy of lysol inhalers and uv light enemas comforts nobody. ,05/21/2020,lysol
What an awful women. Poisonous PELOSI continues mocking her president with outrageous claims. What is she trying to protect with such vitriol? Nancy Pelosi Just Crossed Another Line – Now She Claims Donald Told People To Breathe Lysol ,05/21/2020,lysol
Uuhhhh ya think!!! Its called Fear Mongering People! Keep wiping everything with lysol wipes....thanks CDC for updated news ,05/21/2020,lysol
Bc trump could care less if Americans die all about him & his lies and distraction about Obama who had8 scandal free terms and winner Nobel prize trump pushing Lysol cocktails and drugs not proven safe,05/21/2020,lysol
"When the guy told me it was one Lysol container per household, I swear I felt like leaving and coming back dressed as someone else ",05/21/2020,lysol
After 3 days of taking the Lysol my dad finally noticed and FaceTime me to ask where his Lysol ,05/21/2020,lysol
Top 3 companies THRIVING off covid-19: 1.) @amazon 2.) @barstoolsports 3.) @Lysol,05/21/2020,lysol
BC his supporters inject Lysol,05/21/2020,lysol
Its coming y'all.... they said June... on some show I was watching @Lysol #Help,05/21/2020,lysol
This burn is more flammable than a bottle of non-ingested Lysol. ,05/21/2020,lysol
Crap I bought all those Lysol wipes ,05/21/2020,lysol
It’s bananas in Walmart no toilet paper no Lysol haven’t seen a can of that in forever y’all stay safe ,05/21/2020,lysol
"I said “Yay, finally found some Lysol.. she says $23 a can” ",05/21/2020,lysol
Why are y’all using Lysol wipes to wipe your mirrors,05/21/2020,lysol
Got N art supplies at the dollar store. Woman bought *all* the lysol wipes AS they were unloading shipmemt bc they “didn’t have a sign up yet” limiting her ,05/21/2020,lysol
Fauci must not be invested in Lysol.....,05/21/2020,lysol
"It was a family take over at the tattoo parlor today... And it was AWESOME!! And yes, I wore my mask and did my best to Lysol and purell myself! And no, I did not get a tattoo. But yay for my Mom, her Sister, Her… https://www.instagram.com/p/CAglgQFBmv_/?igshid=e105wmhi1ag8",05/22/2020,lysol
"#COVIDー19 has NOT killed 99.9% of Americans over age 65. #Clorox and #lysol DO kill 99.9% of germs, bacteria, and viruses. #Trump2020 @realDonaldTrump",05/22/2020,lysol
