Text,Date,search_term
"Well he IS out today and on the streets, and showing respect by masking his nose and mouth, unlike that SIR Lysol Von Syphilis cowering in a bunker, blaming Obama for how it looks when Obama NEVER once used it! ",06/01/2020,lysol
SIr Lysol Von Syphilis via @Baligubadle1 and her brilliant assessment,06/01/2020,lysol
"I find it fascinating that I got a suspension for a post repeating what the original person posted (but he didn't the boot for) using the EXACT same words as Lysol Von Syphilis uses! Why is it okay for t*ump to use those words, but I can't?",06/01/2020,lysol
"Exactly!! If by using that word, I would say we CAN see right through the whole shenanigans put on by Lysol Von Syphilis",06/01/2020,lysol
"No, those are what is known as ""boloteros"" Miami PAID thieves who confiscate nursing home ballots, fill them out for Rubio & Scott & Lysol Von Syphilis. Three of them were caught in 2016.",06/01/2020,lysol
"""president"" Lysol Von Syphilis via the great @Baligubadle1 Credit is ALL hers, although I wish I had thought of it first.",06/01/2020,lysol
"""president"" Lysol von Syphillis via the brilliant @Baligubadle1 Mad props for her perfect new moniker",06/01/2020,lysol
Have been drinking the bleach Trump recommended? Or is it Lysol you preffer with your food loo,06/01/2020,lysol
"And if your sexist, racist, sociopathic leader told you to inject lysol, you'd consider it. #MAGAMiscreant",06/01/2020,lysol
"Del tipo: “¿quien te dijo que te eches el Lysol para salir a la calle?, si te cae en la piel al rato un cancer y a ver quien te ve porque yo no tengo tiempo” o “si le andas apachurrando así al celular solo vas descomponer la pantalla...no, el celular no se apachurra solo”",06/02/2020,lysol
Yet this is acceptable to you? Stop drinking the Lysol. ,06/02/2020,lysol
"The POTUS has told over 19,000 lies since his inauguration.Yet, this is your concern. A 3x married, porn screwer, who is legally banned from operating a charity is your hero. Stop taking the Lysol. ",06/02/2020,lysol
"Found some Lysol for Mom...lol She happy now! @Southgate, Michigan https://www.instagram.com/p/CA8lyYFlm-n/?igshid=1ch7lw4p08s2j",06/02/2020,lysol
"Bro, that's worth more than gold right now. I can't find some Lysol products anywhere!",06/02/2020,lysol
"me: “pink drinks don’t affect me w their high caffiene” also me: *slept for 5 hours and worked 5.5, came home and cleaned the inside of my car and vacuumed it, vacuumed my bedroom and my walls, dusted everything, changed an air filter, wiped everything down w lysol*",06/02/2020,lysol
I miss Lysol wipes,06/02/2020,lysol
Stop. Drinking. The. Lysol. Oh...and this ,06/02/2020,lysol
Okay mop water ? Is that with Lysol or spic and spam . Lol,06/02/2020,lysol
Well at the very least we can disinfect it Lysol or Bleach #WearAMask #Biden2020 #RIPGeorgeFloyd,06/02/2020,lysol
"Still to this day (June 2, 2020), the Lysol spray (or any disinfectant spray) and sanitized wipes are very scarce. I was finally able to get one of each yesterday at Walmart. They were the last one of each sitting on the top shelf. I've been trying all over town for four weeks! ",06/02/2020,lysol
"If you need a place to rest, heal, organize, plan, make calls, use Wi-Fi, if you need a place to cry, if you need a place to store 190 bottles of lysol, this home is a place for YOU. It ALWAYS has been. And ALWAYS will be, open. #LETTHEMBREATHE",06/02/2020,lysol
Throngs of people looting while the city employs a lysol spray boy for the mayors podium. ,06/02/2020,lysol
"What ""facts"" are wrong? The mere definition of a fact means they cannot be ""wrong"". If anything I posted was wrong, they wouldn't be facts. Go drink some bleach or Lysol. You are overwrought!",06/02/2020,lysol
"@amazonmex buenas ofertas del súper, tiene lysol y una serie que me tiene muy picada #quemaspuedopedir",06/02/2020,lysol
"LOL, listened to L.A. mayor’s speech which seemed sincere but socialistic at several points.He finished&some man ran up & sprayed Lysol all over the mic and podium and did it so fast I had to laugh. #SNLMoment #Riots2020",06/02/2020,lysol
"Little Man, it seems to me that every time your Wife Cheating Daddy says something very stupid, you try to top Lysol. Oh, you cheat too. The questions, have you met Gavin? Have you cheated on KG yet? Why did you abandon Five Kids? https://twitter.com/DonaldJTrumpJr/status/1267593929479815175",06/02/2020,lysol
"Jeff, you are almost a bigger Asshole than Lysol. Wipe your mouth, disgusting. https://twitter.com/realJeffreyLord/status/1267593455288680448",06/02/2020,lysol
"You are a complete, certified Idiot. Come on, Bobby, supporting Lysol, The Wife Cheater, Racist, Misogynist, Fraudster; what kind of man are you? Don't answer, I know. A thief. $17M in assets. How in the Hell did that happen? It appears you are in it for the money. Stop begging. https://twitter.com/robertjeffress/status/1267590804140363776",06/02/2020,lysol
2 servicios de @Uber_MEX que he pedido el día de hoy y ninguno utilizaba cubrebocas ni traía lysol. Como si no pasara nada ,06/03/2020,lysol
Are you looking at a mirror? Trump imagines that Lysol is the cure for Covid-19 and tells right wings to drink it or shoot it. But wait: He said something but meant something else.,06/03/2020,lysol
I’ve heard lots of nuance about police budgets. I have fam who are officers getting sprayed w Lysol &amp; deprived of PPE gear for covid — but they have riot equipment. Great questions to dive into! ,06/03/2020,lysol
One asked his people to bang thaali and the other asked them to drink Lysol...educated.. ,06/03/2020,lysol
ONLY substitute Lysol wipes for toilet paper if you're racist. #Facts #punchnazis,06/03/2020,lysol
Lo rociaron con Lysol,06/03/2020,lysol
"Woah, little fella, take a breath. Go buy a belt, you're struggling trying to hold up those big boy britches. We Americans will figure out our political struggles without you throwing stones. Using that can of Lysol...found some of you on the bottom of my shoe. Run along now.",06/03/2020,lysol
"And shortly after these pictures were taken, the archdiocese had the church sprayed with #Lysol",06/03/2020,lysol
"Did he pick #lysol or #Clorox? #Hydroxychloroquine or bright sunshine? Or, the miracle that it just goes away in April? Or, is he still busy playing #doctor?",06/03/2020,lysol
We both wear a mask. And I constantly make him wash his hands. Before and after therapy. I also keep hand wipes and travel Lysol on me. They aren’t letting any other guests inside. So it’s easier to practice social distance... He didn’t like teletherapy so I had no choice.,06/03/2020,lysol
I sewed four cute masks so I can wear a different flight for every connecting flight lol! I can’t find sanitizing wipes anywhere. Not like I can bring a can of Lysol in the plane...or can I? Good luck with your travel! Lol!,06/03/2020,lysol
"Thanks for welcoming a COVID-19 superspreader event. Trump wants every seat filled. Trump does'nt want Social Distancing or masks. Assuming you'll be at convention, are you going to wipe yourself down with Lysol before going home to your family? #Jacksonville #Florida #Trump #GOP",06/03/2020,lysol
Dementia?? Trump cannot even read a thought that someone else writes for him so that we don’t have to hear his jibberish. Shooting up Lysol and sticking a light up you is a functioning mind? Good day to you buttercup.,06/03/2020,lysol
He never used troops against American citizens. He didn’t ignore info given in briefings that resulted in 100k deaths. He never suggested shooting up with Lysol and there is no Obamagate. Trump needs to go! Vote the GOP out from top to bottom!,06/03/2020,lysol
*sniff* It just seemed too good to be true. *sniffle* Just too wonderful. Too in line with what I wish I’d said. Who is that grandiloquent mystery man? I’d like to send him some Lysol!,06/03/2020,lysol
"Whoa now that’s big. I haven’t seen any of that in months. Not spray, wipes, liquid you put in a bucket with water. No Lysol stuff at all. I’ll start looking harder now",06/03/2020,lysol
"Right, “ it’s a hoax, it’s like the flu, we only have 15 cases. It will be gone soon.” Inject yourself with Lysol and stick a light inside. He was briefed for months about this and did nothing. Blame the governors?? I think not. This blood is on his hands.",06/03/2020,lysol
And I found some Lysol wipes. I’ll be having them right in my purse at all times .,06/03/2020,lysol
"Lmaoo Walmart just let 10 people get all the Lysol products. I would be mad, but I made the cut then gone tell us their is a limit if 1 too late",06/03/2020,lysol
" bruh. That’s true tho, make sure they got Lysol spray to spray behind themselves",06/03/2020,lysol
I still can’t believe people voted for this man. A man that thinks wind turbines cause cancer & that injecting ourselves with Lysol cures the coronavirus... ,06/03/2020,lysol
I don't think a bleach and Lysol #COVID19 cocktail hour with hydrochloroquine hors d'oeuvres was too much to ask Governor Cooper...but okay. You probably saved your state a bunch of riots so there's that.,06/03/2020,lysol
I don't think a bleach and Lysol #COVID19 cocktail hour with hydrochloroquine hors d'oeuvres was too much to ask Governor Cooper...but okay. You probably saved your state a bunch of riots so there's that.,06/03/2020,lysol
"Because there are much more important things going on in the world. I just needed to tell someone, at the end of this day, that I finally cleaned out that trunk and I think it'll be a nice place to keep my art supplies once I'm able to get some Lysol for the mold.",06/03/2020,lysol
Currently thinking about the old days when @realDonaldTrump used to tell us to digest @Lysol.,06/03/2020,lysol
Lysol Wipes From #Costco |Waited for more than TWO MONTHS| How To Saniti... https://youtu.be/1izY3qkXufA via @YouTube,06/04/2020,lysol
Bleach. Lysol.,06/04/2020,lysol
"Ya estoy saliendo un poquito más. Por un café y me regreso, por snacks y así... pero nada más de pensar en el ritual de limpieza del regreso me aguanto las ganas de la flojera. Que si límpiale las patas a Luci, que quítate los zapatos, baña todo en Lysol, lávate las manos 3 veces",06/04/2020,lysol
@Lysol where can we get cans of Lysol where there is no price gauging??? @nyc311 8 bucks a can at Ideal supermarket in Rochdale Village is a rip-off!!,06/04/2020,lysol
Olor a Lysol ,06/04/2020,lysol
مليت وانا اشرب قهوتي اب نكهة Lysol Early morning breeze ,06/04/2020,lysol
Stop drinking Clorox and Lysol... ,06/04/2020,lysol
"I don’t travel without Lysol, wipes, hand sanitizer .... I think we may be alright lol ...",06/04/2020,lysol
"Most airlines aren’t social distancing and I think 16 and under doesn’t have to wear a mask. Some airlines are not filling the middle seat so I guess that helps. I found some travel sizes Lysol at Target. Add in masks, hand wipes, Lysol wipes, hand sanitizer, gloves. So...",06/04/2020,lysol
"En resumen, la estrategia es eso, más las estampas y abrazos ? Y yo usando tapabocas, gel, guantes, lentes, Lysol, duermo bien, me ejercito, como sano y hasta gárgaras de MMS (Dióxido de Cloro). Ahora sé que estoy mal informado. ",06/04/2020,lysol
my mom made me Lysol my shein package and open it outside ,06/04/2020,lysol
My moms kinda buggin I’m going to another protest lol... she’s spraying Lysol all around the house ,06/04/2020,lysol
Don't forget UV light up the anus and Lysol injections.,06/04/2020,lysol
First we runout of #toiletpaper &amp; #lysol. Now we are out of #cakemixes. What’s going on? @nofrillsCA what am I going to eat? #cake #COVIDー19 #Quarantine – at Qais' No Frills,06/04/2020,lysol
“I had a dream last night that I had Lysol wipes again” - @chasenjames23,06/04/2020,lysol
Obviously he's been in the Lysol again. #TuttiFruittiawRudy,06/04/2020,lysol
"REMEMBER: 9:00pm is a soft deadline, we are protesting until MIDNIGHT. If you have Lysol or Clorox wipes, PLEASE BRING THEM. Thank you everyone, let’s keep up the good work. ",06/04/2020,lysol
"And get parents are losing their minds, washing their kids in Lysol. 0 deaths under 20.",06/04/2020,lysol
Was about to put Lysol on my granite countertops and had to catch myself ,06/04/2020,lysol
This girl wanted me to sell her a can of my Lysol... how much is too much? ,06/04/2020,lysol
"I am a clean F R E A K, get yo DIRT DIRT ass away please *sprays lysol* ",06/04/2020,lysol
With a little shot of Lysol and Clorox ,06/04/2020,lysol
Fill those mister things with Lysol,06/04/2020,lysol
Heh yeah. I did get Lysol spray though finally.,06/04/2020,lysol
"Si, una vez vi que vendían un litro de gel a casi 200 pesos y el lysol también por ese precio o mas",06/04/2020,lysol
You guys have been binging on Lysol . Haven’t you ?,06/04/2020,lysol
He’s still in the bunker shooting Lysol ,06/04/2020,lysol
"That's very sweet. Just can't seem to get stocked up on anything really. Still haven't seen any lysol or rubbing alcohol since lockdown. Hard to get paper towels, toilet paper, etc.. ",06/04/2020,lysol
Why is the most popular cleaning supply on that wipe mirror challenge thingy Lysol?? Y’all ain’t ever heard of windex?,06/04/2020,lysol
Latex gloves. We’re still the city with the strongest pandemic restrictions at the moment. Everyone has masks and many had gloves. Some volunteers even stood on the corner spraying down anyone with Lysol who wanted it lol,06/04/2020,lysol
"Que cosas, a ellos con aplausos y a mi una cliente me recibio con un baño de lysol ",06/04/2020,lysol
this little girl that works with my sister came around her yesterday coughing in her face saying how her hair dresser has COVID-19 and if she has in the everyone is going to get it.. so my sister sprayed Lysol in her mouth. I Stan a young queen ,06/04/2020,lysol
"lol 13...632020... ...don't do Lysol, kids!... ",06/04/2020,lysol
It's hydro-chlorine so obviously the most is now looking for some Lysol to sunbathe in,06/05/2020,lysol
The air got foul and smelled of rotting pumpkin when Airforce 1 landed. I hope we can get the grease out of anything he touched. SEND LYSOL!,06/05/2020,lysol
@POTUS @realDonaldTrump @GOP @GOPChairwoman @GOPLeader @senatemajldr @SenateGOP @HouseGOP The air got foul and smelled of rotting pumpkin when Airforce 1 landed. I hope we can get the grease out of anything he touched. SEND LYSOL! #BunkerBabyDonald,06/05/2020,lysol
I scored Lysol today so I got that goin’.,06/05/2020,lysol
Lysol no le ve ni media a Clorox. #HousewifeFacts,06/05/2020,lysol
Why can’t they spray it down with Lysol,06/05/2020,lysol
I just paid full price for Lysol wipes y'all pray for me ,06/05/2020,lysol
"-que rico hueles, ¿que perfume usas? -Lysol La nueva normalidad",06/05/2020,lysol
#newyorkcity #streetphotography #streethustlers #masks #masksforsale #handsanitizer #lysol #hustle #uppereastside #ues #nyc #newyorkstateofmind #ilovenewyork #ilovenewyorkcity #86thstreet #staypositive #washyourhands… https://www.instagram.com/p/CBELwxungvh/?igshid=gfog71d6olsl,06/05/2020,lysol
Where can I find a black owned Lysol spray alternative,06/05/2020,lysol
bruh has Lysol just stopped making disinfecting spray?? like where the fuck is it,06/05/2020,lysol
It went from smelling weed everywhere to smelling Lysol lolz,06/05/2020,lysol
"I just cleaned my steering wheel with a Lysol wipe, and it was dirty.",06/05/2020,lysol
"If it can stay in garage unrefrigerated I do it. I bought a big jug of concentrated Lysol &amp; spray bottle and I spray everything. I know we’ve been told we don’t have too but we were also told we didn’t need to mask unless WE had the virus, 4 me I’m doing what makes me feel safe.",06/05/2020,lysol
I literally hit the jackpot #grocery shopping today! Lysol wipes &amp; bread machine yeast! Things are loooong up! #smallvictories #covid,06/05/2020,lysol
Una vez mi papá me contó que hizo un vuelo de Trinidad y Tobago a CDMX y cuando ya iban a despegar pasó un sobrecargo a sprayear lysol por todo lo largo del avión. Mi padre dijo que fue un acto desagradable para todos los negritos que viajaban. Ahí supe por 1a vez lo del pH.,06/05/2020,lysol
"Lol.. I got high, decided it was a GREAT time to reprogram autodial on cell fone...moved 911 off- but accidentally hit it. Never showed as call.Nxt thing, PD knocking on door, grabbing lysol, etc- told them what i did.Seems if u even accidentally hit that 911 , even if not call,",06/05/2020,lysol
"Brendan shared something he heard from someone, “too bad the world isn’t like a football locker room.” Might need some Lysol spray, but I think I get it.",06/05/2020,lysol
Ugh ok. Yeah I haven’t had an issue. I have a mini stockpile but I’m in columbus,06/05/2020,lysol
"Where do you live? Walmart/target has had it almost everyday. My uncle lives in NYC, I just sent him like 12 cans",06/05/2020,lysol
We should take our boys to the park soon! I take a thing of Lysol wipes and Lysol the swings. Or just take our boys for a walk. River loves walks. I know Jude is adventurous! Maybe he can show River some cool things!,06/05/2020,lysol
We have Lysol spray and wipes!!! – at Walmart Supercenter,06/05/2020,lysol
With him calling himself The Chosen One. Who the fuck choose him for anything. Just look what he’s done. We are no longer the leader of NATO. He then stopped funding the WHO..He called the virus a hoax made up by the Dems he said shooting up Lysol will protect you against the ab,06/05/2020,lysol
Thank you,06/05/2020,lysol
Ain’t the Lysol on the top shelf? How did you reach? ,06/05/2020,lysol
I finally found lysol spray!! ,06/05/2020,lysol
"Trump killed 109k by ignoring briefings, saying it’s a hoax, flu, only 15 cases will be gone soon, talked I out shooting up Lysol! This is all on him!",06/06/2020,lysol
Bleach and Lysol should clear that up.,06/06/2020,lysol
Taking too much Lysol! ,06/06/2020,lysol
"The 109k dead because he ignored info given to him in briefings, saying it’s a hoax, 15 cases zero soon, it’s like a flu, shoot up Lysol, economy in the toilet. We won’t forget and we will vote.",06/06/2020,lysol
Walmart: 2 Lysol por persona yo: ,06/06/2020,lysol
My favorite chant! Largest crowd yet! I mainly stood in one spot and kept my distance. I had my hand sanitizer & Lysol What an experience! Haters can stay mad. GTFO – at The White House,06/06/2020,lysol
Lysol is impossible up here,06/06/2020,lysol
Have you found Lysol?? ,06/06/2020,lysol
Ya entendí! lysol inventó #COVIDー19 para volverse millonario. Que ciego estaba,06/06/2020,lysol
"109k people dead, economy in the toilet, completely ignored briefings warning about the virus, “it’s a hoax, only 15 cases will be gone soon, it’s like the flu, will take forever to get here. Shoot Lysol.",06/06/2020,lysol
Let’s not jump to conclusions. Exactly what did he do to infuse economy. Oh that’s right - he gave Lysol injections to it! Oh if that hadn’t worked he was going to shove bright lights up the you know where to help it.,06/06/2020,lysol
I live with a man who believes spraying lysol is the same as spraying air freshener,06/06/2020,lysol
"But while the zodiac killers learns about amazon 3rd parties I must ask Why are we still out of things? Amazon says Lysol wipes &amp; whatnot are prioritized for essential workers. But hospitals aren’t over run, etc. So how do we still have a shortage? I know y’all ain’t cleaning ",06/06/2020,lysol
Where can I buy some damn lysol fuck,06/06/2020,lysol
"That was MEMORIAL DAY family fun time! Lots of camo, (wud bet my Lysol Spray...oh wait-can’t get during pandemic) so tp, that like their leader, “the Chosen One” theres not a soldier in t/MAGA Cult~they just also lik to dress up (see-no masks!) &amp; pretend they’re relevant!",06/06/2020,lysol
"The Lysol/knoff Lysol is not available, L've been looking for weeks and can't get it.",06/06/2020,lysol
Got water to donate to protestors & came across Lysol! Woot! I don’t ask for much ,06/06/2020,lysol
"For us the toilet paper crisis has passed, aisle is fully stocked. But try to find Lysol wipes or yeast!",06/06/2020,lysol
If someone is going to drink Lysol they need their head examined.,06/06/2020,lysol
I'm in Texas is very hot here and I have 2 bottle of sanitizer and 1 bottle of Lysol spray tin bottleand I've never had ,06/06/2020,lysol
WTFFFFF Further evidence those Lysol injections are a reallyyyy crappy idea... #Trainwreck #Unfit2Serve #NichtMeinFührer,06/06/2020,lysol
"However... all that spitting in my face, I would have sprayed him with hand sanitizer or lysol.",06/06/2020,lysol
I walked into my parents house smelling loud...my dad ran up to me and sprayed me down with lemon Lysol just so my mom didn’t smell me. What a champ.,06/06/2020,lysol
 mamá dame el lysol #goals,06/06/2020,lysol
"Nivel: siempre tengo una mochila en el auto con muda de ropa, gotas pa el ojo rojo, lysol y así...",06/06/2020,lysol
The fact that @_AbrilYMayo has Lysol spray as her Avi though ,06/06/2020,lysol
"Absolutely, gloves too. Wiping every thing down with Lysol wipes and bleach. ",06/07/2020,lysol
I wonder how many of them dumb mf actually cut it off like they started drinking Lysol after Trump advised them to do it ,06/07/2020,lysol
"Día 77 Cuarentena. Día 101 con Coronavirus en México: Y que me marca a las 8:20am en domingo. “Qué pasa?“, le pregunto. Ella, agitada, me dice: “Encontre lysol de a 100pesos el grande”. #NoMamar ...que me visto en chinga y que la alcanzo en el súper.",06/07/2020,lysol
"As more sanitizing supplies and #PPE become available, I am going to stock-up (not hoard) this summer. I do not want a repeat of this past Spring of not being able to find ANYTHING on store shelves. #Prepper #HoustonPPELocator #Houston Still cannot find @Lysol ANYWHERE. ",06/07/2020,lysol
I see you have the Lysol at the ready to sanitize any boo-boos you find. Smart!,06/07/2020,lysol
"$3.99 for Lysol wipes, and only $21.00 shipping? Seems reasonable! ",06/07/2020,lysol
"Okay, my order arrives from the grocery store. I still wipe down everything with Lysol ",06/07/2020,lysol
lysol is good for covid but I think if you take it.. you should do Mountain View. I’m still here,06/07/2020,lysol
"@Lysol @Lysol Here it is , June 7th and still no Lysol disinfecting wipes to be found on store shelves in Detroit and the Detroit area.",06/07/2020,lysol
"Yo diario: Ay, ya no voy a utilizar tanta madre... Se me van a fregar mas los pulmones por tanto cloro, ddt, alcohol, jabón, Lysol Paulina ahorita: a 2 de intoxicarse por haber echado tanta madre (otra vez) ",06/07/2020,lysol
Good Sunday Vibes Alica Myers playing and auntie Anita ; The smell of Lysol and bleach all thru the crib Vaccum lines coming thru ,06/07/2020,lysol
Found everything we needed at Costco this am including Lysol wipes!,06/07/2020,lysol
Lysol!?!?!? Wow and neither one of y’all sent this to me??!,06/07/2020,lysol
He never said swallow Lysol you flake!!,06/07/2020,lysol
"Como que ya se tardaron en darnos un emoji con su tapaboquitas, ¿o no? O con su botellita de Lysol, digo sho.",06/07/2020,lysol
"On fucking believable. Now we know how the moron in chief got appointed by Putin. I hope they take all of these people out of the gene pool, they do not need to reproduce—Drinking the Lysol https://www.palmerreport.com/analysis/drinking-the-lysol/29456 via @PalmerReport",06/07/2020,lysol
Might as well inject Lysol.,06/07/2020,lysol
Yes combined with the proven effective cocktail of Lysol and Clorox. He will show us all how much smarter he is than the scientists once and for all ,06/07/2020,lysol
Trump is losing his mind. He said people should inject bleach and Lysol.,06/07/2020,lysol
"I forgot Lysol wipes, but those I haven’t seen in a very long time",06/07/2020,lysol
Shouldn’t you be shooting g Lysol? ,06/07/2020,lysol
Smells like Lysol... idk lol,06/07/2020,lysol
Jealous of their Lysol wipes!!,06/07/2020,lysol
Something like Lysol or any spray disinfectant,06/07/2020,lysol
Trump est pas le mec le plus crédible. Il a aussi dit de injecter du Lysol pour s'immuniser contre la Covid,06/07/2020,lysol
Complimentary bleach injections and Lysol shots! ,06/08/2020,lysol
I scored two cans of Lysol for under $100!!!!,06/08/2020,lysol
"Liquid gold, I can’t believe I found Lysol. Check your local family dollar, mine had several bottles. #cleanhouse #sanatize #fresh #lysol @Rockdale County, Georgia https://www.instagram.com/p/CBMRfCIh5eM/?igshid=19vm3vo26tx7v",06/08/2020,lysol
"When the next round may happen (hoping it doesn't), please remember ""you can't fix stupid"". It's because the Domestic Terrorist in Chief is misinforming his base. Trust the Experts and Science. Please, don't drink/inject the Lysol.",06/08/2020,lysol
Idk I heard a lot of people saying that before they brought groceries inside their house they wiped everything down with Lysol,06/08/2020,lysol
do us all a favor and go ingest some lysol phil,06/08/2020,lysol
I really had a client tell me that a barber sprayed his head with Lysol during the pandemic ,06/08/2020,lysol
I spray Lysol ahead of me so watch out!,06/08/2020,lysol
"USA ain't drankin da MAGAritas! MAGArita-1part Lysol,1part purell, splash of bleach &amp; hydroxychlorquine to taste. Leave in sun to soak up rays for 1hour. Drink &amp; head to rally! Causes blatant lying, low IQ, lack of empathy &amp; poor judgement. Nov. Make Happy Hr gr8 again! ",06/08/2020,lysol
I went to visit one of our factories today and was sprayed all over with Lysol upon entry. Lovely. ,06/08/2020,lysol
